1686168	jbo	ro da poi ke'a sinma ke'a cu se sinma ro de poi ke'a sinma di
1686170	jbo	la kikeron cu du la tulius
1686171	jbo	ro da go du zei kikeron gi du zei tulius
1686173	jbo	la daniel cu ropamoi panzi la iakob
1686179	jbo	la rebekas cu se tixnu su'o re da
1686181	jbo	la kain na kurji lo bruna be ky
1686188	jbo	la karl cu clarai lo ro jmive nanmu
1686191	jbo	lo ropa perli poi stali le tricu cu fusra
1686193	jbo	re namcrprimu cu jbini li pano bi'i li pavo
1686195	jbo	ro ricfu prenu cu ponse su'o re karce
1686197	jbo	su'e pa xabju be la ritcmond ba jinga le cunso
1686199	jbo	ro nonmau mulna'u cu lamli'e pa da
1686205	jbo	la batman jo'u la robin cu se steci lo ka balpre bu'u la gotam
1686207	jbo	su'e re da pacpre bu'u la gotam
1686209	jbo	la keis cu sinma ro da enai ky
1686212	jbo	la keis cu sinma da'apa prenu enai ky
1686220	jbo	ro da du su'o de
1686222	jbo	pa tadni cu sinma ro ctuca
1686224	jbo	su'epa ctuca cu se sinma ro tadni
1686226	jbo	la aristoteles jo'u la dekart cu se steci lo ka ke'a mencremau ro se ctuca be ke'a
1686229	jbo	li re du lo ropa namcrprimu poi lamli'e lo namcrprimu
1686230	jbo	li re se steci lo ka namcrprimu je cu lamli'e lo namcrprimu
1686232	jbo	no prenu cu sinma su'o prenu poi ke'a sinma da'apa prenu enai ke'a
1687219	jbo	mi na kakne lo nu jacygaigau le palta .iki'ubo le jacysabji na ca sabji
1687373	jbo	mi na kakne lo nu selma'e lo xirma .iki'ubo le mi tuple cu spofu
1687386	jbo	mi lo nu kamjunmre tadni na kakne ri'a tu'a lo savru
1687406	jbo	pare'u lo nu mi le'ipli lo jukpa cu cabna
1687567	jbo	mi ba binxo lo mikce
1687568	jbo	la bil ba jinga xu
1687575	jbo	ko'a pu cpedu lo nu sidju .i ku'i noda sidju
1687576	jbo	.i xu noda sidju do
1687581	jbo	ca lo nu mi pu citno kei mi ta'enai ci'erkei lo boltipyboi
1687586	jbo	do simlu lo ka se fanza
1687590	jbo	e'o ko ba'e masno tavla
1687593	jbo	xu do nelci lo nu do nonkansa
1687599	jbo	mi pu cinmo lo ka tolgleki kei lo nu mi tirna lo notci
1687604	jbo	lo terdi lo solri lo ka cmalu cu zmadu
1687606	jbo	e'o ko sidju mi
1687615	jbo	mi pu djica lo nu mi misno boltipyjvi
1687616	jbo	lo mlatu na citka lo badna
1687620	jbo	mi na tavla fo lo sanbau
1687623	jbo	do tatpi xu
1687634	jbo	ma te sidju do mi
1687637	jbo	xu do kakne lo nu limna
1687639	jbo	lo patfu cu mutce tatpi
1687640	jbo	la tom pu cusku fi la maris fe lu lo lisri pu na jetnu li'u
1687645	jbo	mi kakne lo nu tavla fo lo jugbau
1687646	jbo	li'a ko'a ricfu
1687647	jbo	la tomis xamgu nanmu
1687651	jbo	e'o ko sanga da bau lo do bangu
1687653	jbo	xu do djuno da lo ko'a lanzu
1687654	jbo	ko'a na bruna mi .i ko'a tamne mi
1688610	jbo	xu ro le vorme cu telga'o
1688621	jbo	so'u prenu cu batkyci'a sepi'o ro le xandegji
1688661	jbo	ko'a palci ca lo nu ko'a genai jbena gi cilre lo ka palci
1688674	jbo	mi tcexagji ca lo cabdei
1688677	jbo	le vi kabri cu tirse
1688919	jbo	.e'unai ko na gasnu lo selcpe be ko'a
1688920	jbo	ca lo nu do seicni ku .e'u ko morji fi lo selgei be mi'o
1688929	jbo	mi sanga bau la berber.
1688947	jbo	la tom. sanga lo melselsa'a
1688951	jbo	mi na kakne lo ka sanga bau lo jugbau .iki'ubo ri nadydu'e
1688955	jbo	ro da poi sinma pa selctukansa cu se sinma re selctukansa
1688957	jbo	mi pu tavla lo mi rirni lo nu mi tadni bu'u lo bartu gugde
1688958	jbo	mi pu mo'u tavla lo mi rirni lo nu mi tadni bu'u lo bartu gugde
1689045	jbo	lo se cupra poi vasru lo jgina stika jmive cu jmive ckape lo remna
1689070	jbo	ca le nunpe'i cu jibmatygau la tom. lo'i selzu'e ku poi barda
1689127	jbo	.ue la tom. goi ko'a ca'o tavla fo la dzitumbau .i mi na pu djuno lo du'u ko'a kakne lo ka baupli ra
1689164	jbo	mi kakne lo ka cusku naje tcidu tu'a lo jugbau
1689170	jbo	ko cusku ko'a le do mensi
1689179	jbo	mi'a jitro roda
1689203	jbo	lo mujyfa'o cu nitcu lo ka denpa
1689215	jbo	lo nu fanva cu te'irselstati
1689224	jbo	le kibjo'e cu tcesno
1689228	jbo	lo nunfanva cu se tadni
1689236	jbo	lo me mi verba ku je'a nelci lo danlu
1689246	jbo	ca ko'a se nandu lo nu ge tu'a ko'a tolfekybi'o gi ko'a tcidu lo cukta
1689304	jbo	le vi cukta mi se ralte
1691238	jbo	.i mi se dirba la. platon .e ku'i mau bo lo nu jetnu
1691886	jbo	pu facki lo du'u to'e se cumki lo nu lafti lo gacri
1691895	jbo	lo vorme co'a kalri gau la .tom. .i ce'o lo gerku mo'u bajra lo bartu
1691900	jbo	lo me mi mamta ku fengu
1691905	jbo	ca lo prulamdei ku mo'u snime carvi
1691907	jbo	mo'u prulamdei snime carvi
1691918	jbo	de'i li vu'u re brife
1691925	jbo	lo ta fetsi pendo ku ponjo
1691926	jbo	mutce xamgu jukpa
1691929	jbo	lo mekso ve ctuca ku xamgu
1691931	jbo	pu cusku lu mi se gugde lo kenedys li'u
1691934	jbo	la pakistan muslo gugde
1691935	jbo	la sumatras cu daplu
1691937	jbo	xu do ralte lo tcika cartu
1692022	jbo	levi cukta ku me lo cukta po mi
1692066	jbo	lo mudri ku fulta lo djacu
1692067	jbo	la ken ka'e xamgu limna
1692068	jbo	pu nupre fi mi fe lo nu vo'a ba klama ti'u li vo
1692071	jbo	ko'a pu dunda lo junra ko'e
1692072	jbo	pu manku nicte secau lo lunra
1692075	jbo	pu sisku tu'a za'u ta ca'o lo mu cacra
1692076	jbo	ta pu palci ractu
1692077	jbo	ko clira zmadu volve
1692081	jbo	za'u va plise ku barda
1692082	jbo	da plise je cpana be lo jubme
1692083	jbo	lo plise ku cpana lo jubme
1692084	jbo	mi ca'o citka lo plise
1692085	jbo	ti lo plise ku titla
1692086	jbo	da cnita trene se tcana bu'u la kazan
1692087	jbo	da plise ni'a lo jubme
1692088	jbo	ti lo basfa ku klama la minsk
1692089	jbo	mi pu klama la nipon la djunguos
1692091	jbo	mi se zdani la xiogos poi vipsi gugde
1692092	jbo	mi se zdani la izmir
1692094	jbo	mi se zdani la akasakas poi se stuzi la tokios
1692095	jbo	mi se zdani la xiogos
1692096	jbo	mi se zdani la kakogauas.
1692097	jbo	mi se zdani la tokios
1692098	jbo	mi se zdani la kobes
1692099	jbo	mi se zdani la nipon
1692100	jbo	pu di'i tavla fi lo nu te dapma be mi'ai
1692106	jbo	pu jarco tu'a lo palci fukpi za'u me mi pendo
1692112	jbo	mi pu klama lo nenri be lo me ta kumfa
1692120	jbo	lo laldo prenu pu co'a morsi bu'u lo me za'u ta kumfa
1692122	jbo	pu te cpacu lo gerku za'u me ta pendo
1692131	jbo	lo mikce pu lacpu lo papri to'o lo me ta daski
1692134	jbo	za'u ta pu na klama lo nenri
1692143	jbo	xu do pu tavla
1692146	jbo	na cusku
1692147	jbo	.aipei do klama
1692511	jbo	.ie ti jufra lo zasti ranmi be lo me la baskervil lanzu
1692517	jbo	za'a ti me ta jufra
1693195	jbo	ku'i ko'a pu junri tu'a le vi te tcidu
1693225	jbo	ko'a pu stati je certu remna
1693298	jbo	mi te vecnu lo vi cukta ca lo prulamdei
1693304	jbo	co'a morsi bu'u la devoncir de'i li vu'u pi'e pi'e ci
1693310	jbo	se ke satci detri lo nanca be li pazevore
1698466	jbo	mi ba te dunda lo ka jitro le kagni po le mi patfu
1698480	jbo	la tam. pu klama la bastyn. mu'i tu'a lo temvai terkagni
1698488	jbo	le nanmu cu pu mipri vo'a ne'i lo denmi ricfoi
1698495	jbo	ko'a pu ciksi tu'a le tcini mi
1698511	jbo	le micyxu'i cu galfi ko'a lo ka kanro
1698731	jbo	mi djica lo ka ka'erbi'o lo ka limna
1698740	jbo	ma xagrai fi lo ka tolpli lo temci
1698749	jbo	le mi lanzu cu pu klama lo mivdalmuzga mu'i lo ka viska lo cionmau kei ca lo prulamkemyzeldei
1698766	jbo	ko'a mi tamne
1700163	jbo	la tam pu vi'ecpe la meris tu'a lo vacysai
1700179	jbo	mi'a pu viska lo xajmi seltivni
1700265	jbo	ko'a pu tolju'i lo mi ro jdenoi
1700331	jbo	mi cmalu verba
1700348	jbo	lo mi mamta cu fengu
1700349	jbo	lo do zdani cu barda
1700363	jbo	ca lo prulamdei lo mi famti pu terve'u lo gerku
1700368	jbo	mamta terdi
1700422	jbo	da casnu lo ba selsa'a be da
1700435	jbo	mi ba sanga ca lonu ko'a ca'o surla
1701049	jbo	ko punji lo najgenja lo patxu
1701371	jbo	la mortimer poi mikce pu lacpu ta to'o lo me vo'a cutne daski
1701382	jbo	mi na ka'e curmi lo nu ta to'e clita
1702389	jbo	.e'u ko facki fi lo mitsmu jufra be bau sorbau ra'i la'e zoi kib tatoeba.org kib
1702500	jbo	xu do junri platu lo du'u do cliva
1703316	jbo	xu ta djuno lo du'u do prami vo'a
1703342	jbo	lo rismi ku kukte
1703346	jbo	pa ta me mi tixnu
1703439	jbo	ta merko
1703443	jbo	mi viska lo ninmu poi dasni lo xekri
1703728	jbo	ta na nenri
1703799	jbo	ti poi dinju cu ba'o zdani ra
1704155	jbo	ro ko'a pu co'a gasnu co slilu fa lo me ko'a lanci
1705004	jbo	ko'a zbasu lo javni be lo nu ko'a cikybi'o ti'u li xa ca ro cerni
1705050	jbo	xu la tom. roroi bevri lo celxa'i
1705052	jbo	le vi cukta cu srana lo tarci
1705111	jbo	baziku do selsaubi'o lo ka pavysei selzda
1705256	jbo	tu'a lo ka dunku cu cumri'a lo nu tcemalcne lo ka kanro
1705282	jbo	ko fendi le titnanba seva'u redo
1705302	jbo	le nalseljmi be fi le nu ko'a mrobi'o cu pujeca na se namsnada
1705957	jbo	mi pinxe lo ckafi
1705962	jbo	lo mi pendo cu skicu mi fo lo ka tolvri
1705992	jbo	ko ka'argau lo patlu
1707529	jbo	va'o lo balcu'e be bu'u lo razgu'e mi se co'arsau lo melbi ke gugdrpolska ninmu gi'e ji'a penmi lo xe'otce poi se bangrpolska
1707545	jbo	e'o ko sidju mi lo nu bregau fi lo nunsla
1707855	jbo	ko'a pavysei selzda lo ricfoi
1707900	jbo	mi prami ko'a pu lo nu mi mrobi'o
1707902	jbo	tirna lo nu ko'a krixa mu'i lo ka djudji
1708242	jbo	ko'a ciksi lo pe'anai smuni be le jufra
1708266	jbo	ko'a sa'e te se tavla mi
1709391	jbo	ko'a pu klama la paris. mu'i lo ka tadni tu'a lo zgike
1709412	jbo	le selpla na pu selsnada
1709445	jbo	mi pu funpe'i lo saurpe'o vi la toki,os.
1709446	jbo	ca lo prulamdei mi viska lo tanbargu ga'u lo mi zdani
1709482	jbo	lo mi karce cu naljinsa
1709511	jbo	mi famti la djon.
1709512	jbo	ausai mi djica co ponsi lo brablo
1709551	jbo	ko'a mi pendo me'e zo djak.
1709581	jbo	do roroi zanvi'e
1709621	jbo	ko'a selsau le jvinu be ko'e
1709640	jbo	le vi relxilma'e mi se srana
1709805	jbo	ro lo mi bebna .i ri vrici lo po'o ka bebna ma kau
1709809	jbo	gau ko cladu ke cmalu zmadu
1709810	jbo	cladu ke cmalu zmadu
1710057	jbo	do djica co klama fu lo mo trene
1710101	jbo	mi ji'a djica tu'a ta poi creka
1711288	jbo	lo xrani romoi cu se jalge lo nu morsi
1711803	jbo	lo mi patfu ku na curmi lo nu mi ralte lo gerku
1711808	jbo	ralte du'e cukta
1712141	jbo	lo'e tirse cu jdari
1712172	jbo	ko'a selrircpa le cmalu nixli
1712205	jbo	loi glipre cu tcikaizu'e
1712238	jbo	mi'o nitcu lo ka stogau lo ni velve'u kei lo ka cmalu
1712328	jbo	lo du'u le mi menytcini cu xlali kei mi se cordri
1712401	jbo	pu frigau ko'a lo ka vlile
1713769	jbo	mi pu mo'u dasni lo me mi cutci
1713770	jbo	ta melbi traji ke nobli ninmu
1713871	jbo	le mi stizu cu jibni le vorme
1713876	jbo	la glibau cu simlu lo ka mujyku'e
1713888	jbo	pe'u do ko ciska le cmene be ko'a ro se lebna be ko'a
1713889	jbo	mi farcri .i xu do kakne lo ka sidju mi vau pe'u
1713891	jbo	le mi mamta piso'uroi catlu lo tivni ca lo nicte
1713897	jbo	le ko'a skutadji cu nalcni
1713936	jbo	ta na'e spaji vau je'u pei
1713944	jbo	doi rodo mi nitcu lo ka klama
1713962	jbo	fi piro le selpraci'e fa lo ka refyba'o cu simlu lo ka darno
1713963	jbo	mi se mansa le se jerna be mi
1713974	jbo	ko'a jgira tu'a le tixnu be ko'a
1713981	jbo	ko cliva ko'a vi do pu facki fi ko'a
1713998	jbo	ca ma mi'o klamu'o la byrsylon.
1714077	jbo	mi pu cpedu fi ko'a fe lo ka sidju
1714186	jbo	.i li'a loi jdini cu pelji .aucu'i .i je ti dacti je karce
1714188	jbo	.i ti makfa pelji je cu kakne loka binxo ro lo se djica
1714190	jbo	ze'e mutce mipri
1714191	jbo	ko'a xusra lo du'u la terdi cu carna la solri
1714205	jbo	ko'a pu fasnu za lo nanca be li re
1714210	jbo	.ei mi klama lo zdani
1714211	jbo	lo nu mi klama lo zdani cu xamgu da'i mi
1714215	jbo	mi selxau lo nu sipna
1714218	jbo	mi citka lo plise .ui
1714221	jbo	mi citka lo crino .ui plise
1714237	jbo	tcaci .ui do
1714239	jbo	le cukta be'u cu zvati ma
1714242	jbo	.oiro'o bu'onai pei
1714245	jbo	pavyseljirna kavbu ba'o xu ku
1714246	jbo	mi pu viska lo cmalu nanla poi se cmene lu .tonis. evans. li'u
1714247	jbo	coi lo za'u nixli
1714248	jbo	ti poi za'u prenu ku terpa lo nu jamna
1714251	jbo	lo verba ku zgana lo makcu
1714255	jbo	.ei ma'a kurji loi me ma'a laldo
1714263	jbo	ta ba xajmi
1714273	jbo	lo plise ku makcu
1714277	jbo	lo plise ku co'a makcu
1714284	jbo	ta pu jarco lo du'u vo'a stace
1714285	jbo	ta pu jarco lo du'u lo du'u vo'a stace ku jetnu
1714289	jbo	ui mi mo'u volve
1714290	jbo	pe'i ta ba snada
1714302	jbo	xo do morji lo du'u lo me ta cmene ku mokau
1714321	jbo	la tom se panzi re zo'e
1714329	jbo	mi nelci lo esporte
1714330	jbo	mi sisku tu'a za'u pendo vi ku
1714350	jbo	piro le cecmu cu ba cerda le binxo me dyny.abu
1714365	jbo	mi se prami lo me mi mamta
1714368	jbo	ca donri midju
1714371	jbo	ko spusku bau lo glibau
1714376	jbo	.ei mi klama lo pulji tcana
1714380	jbo	la tom. cinmo lo ka sepli
1714385	jbo	ta cadzu klama lo ckule
1714401	jbo	ta pu cpacu mo'a xatra de'i li no ca lo cerni
1714405	jbo	le mi tcadu cu lamji le xamsi
1714412	jbo	ko klama je cu viska mi de'i li no ca lo nicte
1714602	jbo	ma zgicu'a ca lo cabdei
1714613	jbo	ma me dyjy ca lo cabdei
1714648	jbo	je'u le selgungunma cu nandu .i ku'i la naun.xaras. ba kakne lo ka snada mulgau
1714663	jbo	la pongu'e cu selte'i lo ka selda'i fi lo ratyjbama kei lo'i gugde
1714665	jbo	ko'a banli speni je mamta
1714668	jbo	ti vajni
1714669	jbo	mi nelci lo bansupu'a
1714670	jbo	mi ca'o plipe mu'i lo nu gleki
1714674	jbo	.e'u mi'o klama la cinjukus. ca lo bavlamdei cerni
1714807	jbo	lo krokodilo pu mo'u citka lo gerku
1714813	jbo	xo bangu lo ropno se zdani
1714816	jbo	do pu gunka se mau mi
1714821	jbo	lo'e krokodilo ku se ke kinli denci
1714824	jbo	lo patfu be mi ku na zvati lo zdani
1714825	jbo	lo'e mlatu na citka lo badna
1714828	jbo	lo krokodilo ba'o citka la .tom.
1714830	jbo	mi ralte no relxilma'e
1714943	jbo	mi ralte no karce
1714944	jbo	mi ralte no gerku
1714958	jbo	mi ca to'e cando
1714964	jbo	mi na mikce
1714971	jbo	drani danfu
1714972	jbo	ta ponjo
1714974	jbo	lo me do cukta ku cpana lo jubme
1714976	jbo	mi te preti fo ta de'i li pa
1714979	jbo	xu do ralte fe ji'a lo taxfu be pi'o lo verba
1714980	jbo	xo ve ke me do ckule
1714984	jbo	mi ponse lo kibro kagni
1714997	jbo	le mi'o kagni cu pilno le kibro
1714998	jbo	le mi'a kagni cu pilno le kibro
1715000	jbo	le ma'a kagni cu pilno le kibro
1715004	jbo	mi'o pilno le kibro ne'i le mi'o kagni
1715006	jbo	mi'a pilno le kibro ne'i le mi'a kagni
1715008	jbo	ma'a pilno le kibro ne'i le ma'a kagni
1715016	jbo	lo mlatu ku se ke pluka je ranti kerfa
1715021	jbo	mi ponse pi so'o cidja
1715025	jbo	pa ctuca .e za'u tadni ku zvati la muzga
1715028	jbo	lo verba ku nitcu lo nu se prami
1715038	jbo	lo'e mlatu ku se kerlo re da
1715039	jbo	serai tcini
1715040	jbo	ko sisti .i zekri lebna
1715041	jbo	mi ba fonxa tavla lo pulji tcana
1715044	jbo	mi sepli gau ko
1715045	jbo	ko jai gau sepli fai mi
1715721	jbo	le patfu be mi cu tcexau
1715723	jbo	lo do sidbo cu drata lo mi sidbo
1715743	jbo	mi'a pu simta'a le mi'a bavycu'i
1715754	jbo	lo nanmu cu nitcu lo ka gunka
1715778	jbo	le nu ko'a xandegda'i cu simlu lo ka lidysna kei le la .alisi,ys kerlo noi tcega'e
1716146	jbo	su'o ba'oi ze'e na'e misno
1716181	jbo	lo me mi fetsi speni ku ca'o sipna troci
1716182	jbo	ti cukta la .ingland.
1716183	jbo	ta pu dunda lo remna se kelci mi
1716379	jbo	mi pu cpedu lo nu la .ken. cu sidju mi
1716753	jbo	lo me mi mensi lu kelci le prenu se kelci
1716858	jbo	le misno dinju no'u la taj,ma'al. cu selstu la .indias.
1718005	jbo	.ue lo mensi be do cu melbi
1718009	jbo	jogi do lo cukta mi jbera gi ka'e xruti ca lo bavla'i jeftu
1718012	jbo	ko'a klama le zarci tezu'e lo nu terve'u lo narju
1718032	jbo	lo re rirni be mi na'e jvami'e mi
1718042	jbo	.e'enai ro roi lo nu mi do viska kei mi pensi lo mamta be do
1718044	jbo	ko'a jundi catlu le pelji
1718048	jbo	so'o prenu cu jinvi lo du'u ro se zukte pe fi'o junri firtai cu racli
1718053	jbo	.e'o mi ciksi da poi mi cusku djica
1718058	jbo	simlu lo ka le xatra ko'a spaji
1718060	jbo	lu do mi batci ki'e li'u se cusku mi lo mi mlatu
1718062	jbo	lo djacu cu febvi gau do ki'e
1718063	jbo	ckire do lo nu daspo lo mi fonxa
1718064	jbo	jadni lo mi zdani gau do ki'e
1718065	jbo	do joi mi dansu ki'e
1718067	jbo	ko'a ponse so'o melbi ke laldo nilce
1718070	jbo	me lo'e se cusku
1718073	jbo	ki'edo'u do pagre le rirxe tezu'e lo nu sidju mi
1718079	jbo	ki'edo'u do cnidju mi pe ca lo nu badri
1719382	jbo	mi se zdani lo laldo dinju
1719386	jbo	xu do na'e ckeji
1719396	jbo	mi djuno tu'a lo me ta judri
1719486	jbo	xu do djuno lo du'u makau ralte le vi karce
1719688	jbo	.e'o xu do kakne lo ka sapcki
1719739	jbo	mi tolmo'i lo ka sazysti le veltivyvidni kei pu lo nu mi ckakla
1719790	jbo	ba lo nu ko'a depyjdari zgatirna tu'a lo te patspu be fi le tertigni kei le pajni goi ko'a cu stika le jalge
1719810	jbo	mi denpa lo nu li xa cabytcika
1719836	jbo	le sedyta'u cu cimce'oranbi'o
1720327	jbo	ro ti itku'ile ga'a mi
1720328	jbo	ti itku'ile ga'a mi
1720330	jbo	ro ti pu itku'ile ga'a mi
1720333	jbo	itku'ile ga'a mi
1720341	jbo	lo termu'eske cu itku'ile ga'a mi
1721750	jbo	ta poi fetsi pu na prami lo vo'a speni
1722182	jbo	mi klama lo malsi fu lo karce
1722191	jbo	ca lo nondei mi klama lo malsi
1722199	jbo	mi birti lonu ko'a ba sanga bu'u lo malsi ca lo bavlamdei
1722255	jbo	lo sakta cu titla
1722272	jbo	xu do djica tu'a lo sakta
1722297	jbo	mi djica tu'a lo tcati be secau lo sakta
1722302	jbo	ri nitcu lo kabri be lo sakta
1722313	jbo	ri pu dunda fi mi fe lo kabri be secau lo sakta
1722328	jbo	lo sakta cu runta lo glare djacu
1722346	jbo	mi nitcu lo sakta
1723995	jbo	ra mutce mencre
1723998	jbo	ko jundi .i lo karce cu klama
1723999	jbo	mi xebni lo mi jibri
1724001	jbo	la .tam. pacna lo nu do gleki
1724004	jbo	.e'e do lacri mi
1724042	jbo	lo nu lifri cu mamta pe'a be lo saske
1724607	jbo	lo cumterve'u cu pu terzba lo liste
1724629	jbo	le briju cu pu muvdu le xamoi dijysenta
1724650	jbo	lo nu klama la .okinauas. fu lo vinji kei li xo cacra
1725020	jbo	.e'u do nitcu lo ka na lacri ro prenu
1725067	jbo	ganai lo nu ko'a klama cu lerci gi ko dunda le vi notci ko'a
1725110	jbo	tu'a ko'a ba bapli lo nu do citka lo dertu
1725144	jbo	mi terbe'i lo xatra be bau la glibau ca le prulamdei
1725159	jbo	lo cibjmagutci cu du lo jmagutci be li ci
1725203	jbo	la tom. goi ko'a pu ganse lo ka pecybi'o le ko'a birka
1725884	jbo	mi na ka'e renvi lo nu ta jikfanza
1725886	jbo	no da mensi mi
1725912	jbo	.ei po'o do klama ta
1728442	jbo	xamgu nicte di'ai
1728451	jbo	ko sidju
1728454	jbo	cerni coi
1728466	jbo	xu vi ku da se bangu lo glibau
1728483	jbo	la .tokpisin. no'e bangu mi
1728489	jbo	.u'usai
1728497	jbo	mi se cmene zo .tom.
1728518	jbo	ki'a
1728524	jbo	ta'a xu do ka'e sidju mi
1728548	jbo	la'acu'i ti ba cinri do
1728553	jbo	mi banzu gleki
1728559	jbo	mu'i ma lo mi gerku ku na cikta lo gerku cidja
1728631	jbo	ckire fi lo nu morji
1728633	jbo	ko na ba'o morji tu'a lo pikta
1728636	jbo	nu salci ca ma
1728639	jbo	mi pu'o jdice
1728641	jbo	cakla .iunai
1728643	jbo	xu do zifre ca lo bavlamdei
1728644	jbo	ta mlatu je'i gerku
1728647	jbo	mi cliva ti'u li pano
1728651	jbo	ko'a sutra
1728654	jbo	.au sipna
1729300	jbo	ja'o mi pu cirko le mi dinvau
1730315	jbo	ro le rokci cu ba'o muvdu
1730333	jbo	ko curmi lo nu mi viska
1730346	jbo	ma jdima le karce poi kargyrai
1730355	jbo	la tom. pu mrobi'o ri'a tu'a lo karcysnuti
1730359	jbo	lo nu mi'a pu cadzu cu minli li ji'i mu
1730360	jbo	le vorme cu ca'o ganlo
1730416	jbo	mu'i ma do za'o zvati vi
1730430	jbo	do xendo mutce
1730434	jbo	mi ba denpa ca'o pa jeftu
1730442	jbo	do na gunka bu'u lo briju
1730459	jbo	do bebna
1730466	jbo	lo bruna pu ciksa lo xatra be lo mensi
1730468	jbo	xo da pu co'a morsi
1730472	jbo	mi dukse lo ka tolcando ku lo nu kelci
1730478	jbo	pu ku ri'a lo du'u glare kei na ku sipna
1730484	jbo	pluka ke clite pastu
1730486	jbo	pu pendo mi
1730860	jbo	do ma nanca .i li paxa
1730861	jbo	ta'o do ma nanca
1730864	jbo	do nanca li xo .i paxa
1730865	jbo	ta'o do nanca li xo
1730867	jbo	do renvi fi ma .i nanca li paxa
1730868	jbo	ta'o do renvi fi ma
1730869	jbo	do renvi fi ma
1732405	jbo	ba ca ma do klama la .paris.
1732918	jbo	la .tom. pu jai gau spofu fai le canko
1732920	jbo	lo va za'u kacma pixra cu ckini le fetsi
1732929	jbo	za'u va dinju ku barda
1732940	jbo	za'u va xrula ku se panci lo titla
1733200	jbo	ta je'a nelci lo si'o boltipyjvi
1733249	jbo	.oisai
1733250	jbo	.ua na'e xlali
1733254	jbo	pluka
1734986	jbo	do bacru
1734998	jbo	ko stali ti
1735031	jbo	do pu tavla ma
1735032	jbo	do tavla ma
1735033	jbo	lo nanla pu renro lo rokci
1735227	jbo	do pu nurxru mi
1735657	jbo	mi se prami lo rirni be mi
1735663	jbo	mi badri tatpi lo nu badri tatpi
1735664	jbo	mi tatpi
1735666	jbo	mi tatpi lo nu do za'u roi pante
1735667	jbo	mi tatpi lo tivni
1735668	jbo	coi .tom.
1735670	jbo	mi djuno
1735676	jbo	lo nu jmive ku pluka
1735681	jbo	xu do ba'o jdice
1735745	jbo	milxe glare de'i li no
1735748	jbo	ko'a jgira tu'a lo bersa be ko'a
1735761	jbo	mi pu jungau ko'a lo nu ko'e tsuku
1735771	jbo	mi citno
1735773	jbo	speni lo se ke drata gugde
1735781	jbo	lo rarna munje ku vajni ca lo nu ma'a se lifri
1735785	jbo	mi te bilma kafke
1735794	jbo	mi pi so'i roi boltipyjvi ba lo ctufau
1736303	jbo	mi pu te vecnu lo cukta
1736307	jbo	e'apei mi te vecnu loi lenjo po'o
1738756	jbo	lo gerku cu bajra to'o ne'i lo zdani
1740822	jbo	la .tam. xebni ro do
1740826	jbo	lo mi famti pu dunda lo kacma mi
1740828	jbo	ra na pu kakne lo nu limna
1740838	jbo	zo'oi Steve mergu'e cmene
1740851	jbo	pei pi ro do co'a ca ca'o za'i fenki
1740877	jbo	lo mi patfu cu kakne lo nu limna .i ku'i lo mi mamta na kakne lo nu limna
1740918	jbo	xu do pu mencti lo vi skina
1740956	jbo	ra pu nurxru lo verba lo fagri
1740957	jbo	ra pu danre lo batke gi'e pu denpa
1740960	jbo	lo ctuca pu retsku lo nandu preti mi
1740961	jbo	la .tam. pu catra la .meiris.
1740962	jbo	mi na te makfa
1740963	jbo	lo mi mamta na nelci lo nu zgana lo veltivni
1740964	jbo	lo bangitu'a cu verclibau mi
1741124	jbo	mi ca'o denpa tu'a lo mi fetsi ke se prami pendo
1741125	jbo	mi ca'o denpa tu'a lo mi fetsi pampe'o
1743459	jbo	xu lo ponjo prenu cu mutce citka lo finpe
1744740	jbo	da po mi zmadu da po do'o
1744775	jbo	ro lo cipni cu zmazau lo zdani be vo'a
1744776	jbo	si'u lo nanba po'onai lo remna cu jmive
1744782	jbo	lo na gunka cu na citka
1744898	jbo	mi djuno lodu'u mi djuno noda
1745007	jbo	do ba te dunda seki'i lo do se krici
1745010	jbo	do ba terdu'a da pe lo do se krici
1745019	jbo	ko na dunda lo censa loi gerku gi'e na renro lo jemna vi loi xarju tezu'e lonu rivbi lonu ri marxa ti ce'o lonu ri jai daspo do
1745036	jbo	lo remna cu ckaji loka srera
1745040	jbo	ko cipra gasnu gi'u lacri
1745276	jbo	lo mlana po'e lo kurfa cu panra le mlana poi dukti vo'a
1745281	jbo	zerle'a le mi dinvau
1745296	jbo	.u'e ko catlu .i lo cipni cu selvau le va tricu
1745402	jbo	lo vi jufra na glico
1745432	jbo	xu do baupli lo pa'arbau
1745461	jbo	lo mi patfu cu limna kakne .i ku'i lo mi mamta na go'i
1746106	jbo	mi'a pa'o litru le tergu'e lo karce
1746734	jbo	ti mruli i ri na se ponse mi i mi pu jbera ri lo pendo
1746746	jbo	u'ecai tu mo
1746771	jbo	xu ko'a se pampe'o
1746772	jbo	xu ko'a se glepe'o
1746791	jbo	do caca'o stidi ma
1746817	jbo	ko'a na cmima
1746839	jbo	ta nunbebna
1746862	jbo	ko'a pu gasnu ca ko'e pu xalbebna
1746881	jbo	ko'a pu cpedu lonu dansu mi
1746900	jbo	ti du le brablo pe mi
1748484	jbo	lo xekri gerku pu bajra
1748486	jbo	mi raltefe lo xekri gerku fe lo blabi gerku
1748488	jbo	mi ralte lo barda xekri gerku
1748489	jbo	ra ralte lo cmalu xekri gerku
1748556	jbo	pu carvi ca lo prulamdei
1748557	jbo	ru'a ko'a pu gasnu ra
1748726	jbo	lo dinju cu cpana le cmana
1748732	jbo	do gleki se catlu ca lo cabdei
1748748	jbo	.u'a mi ca jimpe
1748827	jbo	xu ko'a klama lo gunstu fu lo sorprekarce
1748924	jbo	mi ralte lo xekri gerku .e lo blabi gerku
1748941	jbo	do pu tolcando
1749256	jbo	ko'a kulmu'o ca lo prulamna'a
1749295	jbo	la .tom. pu gleki zvati le ri zdani ba'o lonu ri ze'uvu zvati
1749380	jbo	le gerku ru'u klama ma'i lo jubme
1750205	jbo	ra tolci'orai
1750458	jbo	ma ciska re xatra
1750479	jbo	mi zasti giji na'e zasti .i di'u preti
1750481	jbo	mi zasti giji na'e zasti .i ba'e di'u du le preti
1750482	jbo	xu mi ba nitcu le nu zasti .i la'e di'u cu se preti
1750483	jbo	.i xu mi zasti .ai .i xu nago'i .i ti te jdice
1750486	jbo	lo cidja poi fange cu kukte zmadu
1750489	jbo	zo'e jarco lo ka menli ca lo nu vo'a cusku
1750496	jbo	losu'u lacri lo certu cu zmadu losu'u se zanru lo jdaca'i
1750499	jbo	lo certu se zgana cu zmadu lo jdaca'i se zanru
1750500	jbo	lo djica cu kakne
1750506	jbo	.i lo prije cu djuno lo du'u makau ru cusku .ije lo bebna cu cusku lo se djuno be ri
1750508	jbo	du'e virnu cu zasti ba'o lo nu damba
1750511	jbo	lo mutce se bacru cu drata lo mutce se cusku cu'u la .soFOKL.
1750517	jbo	lo barda se gunka roroi se kansa lo barda raktu cu'u la .volTER.
1750519	jbo	du'e se cilre cu zmadu no se cilre cu'u la .
1750581	jbo	le gerku cu cadzu ru'u le jubme
1750620	jbo	la .naras. mutce laldo tcadu
1750621	jbo	ko tirna jundi
1750704	jbo	ko'a pu catra ko'e mu'i lo nu venfu fi tu'a lo ko'a morsi patfu
1750742	jbo	ro lo se mipri ba se zgana
1750748	jbo	lo danfu be ro da cu zasti
1750751	jbo	ko ze'u jmive je cilre
1750754	jbo	.i ko te dunda ca lonu dunda .i ko na damba ca lonu damba
1750759	jbo	lo se dejni cu xamgu ca lonu ri se xruti
1750760	jbo	lo se dejni cu xamgu gi'o se xruti
1750765	jbo	lo se frati cu minra lo se zukte
1750768	jbo	ti xrani lo tance
1750776	jbo	lo grute cu simsa lo ri tricu
1750792	jbo	le funca cu na'e pinji je na xance se jgari
1750813	jbo	lo fatci du lo nu ko'a djuno noda
1750838	jbo	ko'a pu minde ko'e lo nu zifcru lo pinfu
1750839	jbo	mi pu frili facki fi le cukta
1750840	jbo	u'u
1750841	jbo	xu do ca'o tavla mi
1750842	jbo	ko'a simlu lo ka xebni do
1750864	jbo	ko pensi pu lo nu zukte
1750873	jbo	lo rokci na limna
1750890	jbo	la lindas mutce nelci lo cakla
1750909	jbo	lo mlatu cu farlu jo sanli da
1750914	jbo	.e'u do ze'a surla
1750915	jbo	mi sipta'i
1750921	jbo	.a'u ko'a ca'o zukte zo'e
1750924	jbo	ro ko'a pu jaurvasmro
1750927	jbo	ko'a zukte zo'e .uanai
1750953	jbo	.oi dai do bilga lo nu stika ko'a sai
1750965	jbo	la .maris. cu pa mei ne'i lo ricfoi
1750981	jbo	le javni na mapti lo dei fasnu
1750986	jbo	mi zmanei lo ckafi lo tcati
1750988	jbo	mi ba'o zgana su'o skina po la .kurosa,uan.
1750994	jbo	xu do terpa lo tepkai skina
1751006	jbo	ko'a mutce nelci lo zgike
1751012	jbo	mi birti tu'a lo ko'a cmene
