2368931	jbo	mi ta'e relxilma'ekla lo briju be mi
2369894	jbo	mi za'ure'u co'a speni
2369897	jbo	mi co'a bilma ca lo prulamji jeftu
2369899	jbo	mu pu dunda fi la tom
2369902	jbo	mu pu dunda fi la tom fe ro lo pe mi jdini
2369905	jbo	mi pu co'u pacna
2369913	jbo	mi de'a morji tu'a lo pe mi ckiku
2369917	jbo	mi pu co'a carmi prami
2369919	jbo	mi pu fliba tu'a lo xukmi saske
2369920	jbo	mi nelci lo caxmati
2369921	jbo	mi pu karce sazri ze'a piro lo pa nicte
2370994	jbo	ju'o ko'a snada tu'a le cipra
2371012	jbo	ko'a djuno noda lo su'u jecra'a
2371067	jbo	tu'a lo gusni befi lo solri cu crori'a lo kanla
2371095	jbo	la .tom. cu cusku lo sedu'u do mi pendji
2371111	jbo	do bangu ctuca fo ma
2371140	jbo	mi na ka'e bacru lo latsna .iri'abo mi smacu
2371181	jbo	mi viska lo nu do xu kansa la .tom. va lo rirxe
2371255	jbo	ganai do fliba le cipra gi do reftadni
2371284	jbo	mi na zukte
2371560	jbo	xu do mulgauka'e tu'a lo kracku pujaca le mumdei
2371801	jbo	ko patsti
2371806	jbo	.a'enai ko patsti
2371808	jbo	.o'onai ko patsti
2371812	jbo	ro cladakyxa'i pilno ba cladakyxa'i mrobi'o
2372219	jbo	rirxe va le zdani
2372241	jbo	doi .suzyn.grin. do se gugdenulu xu
2372290	jbo	la .tom. pu barda
2372295	jbo	ti simlu lo ka tcexau
2372301	jbo	lo nu ro nanmu cu gleki cu na cumki
2372328	jbo	lo su'u la pongu'e cu toljgi kei noi jalge tu'a la .pasifik. zei nunjamna na mo'u canci
2373648	jbo	ji'asai mi pu ciska lo xatra be la tom
2373652	jbo	ji'asai mi pu troci lo ka ciska lo selsanga poi skicu lo nu makau pu fasnu
2373653	jbo	mi pu te pixra lo cmalu xirma
2373655	jbo	mi pinxe tezu'e loka surla
2373656	jbo	mi sazri la porc
2373657	jbo	mi pu falgau lo plise
2373661	jbo	mi vi citka ca ro donri
2373662	jbo	mi vi citka ca ro nicte
2373664	jbo	mi citka va'o po'o lo nu mi xagji
2373666	jbo	mi senpi lo nu ba carvi
2373669	jbo	mi senpi lo nu ba snime carvi
2373766	jbo	lo drata cu nalterlejgu'a
2373773	jbo	xu do bevri
2373797	jbo	pe'u ko laurzengau .i mi milxe lo ka tinka'e
2373822	jbo	lo zvati be lo kensa la terdi cu terselmlu lo ka cmalu
2373849	jbo	sanli .ei sezu'e lo nu tavla
2373883	jbo	ko'a jgira mu'inai tu'a lo se jusysku
2373886	jbo	ko'a jgira tu'a lo tixnu
2373888	jbo	mu'i tu'a le selyli'i ko'a virnu
2376766	jbo	mi se slabu lo nabmi pe do
2376767	jbo	sei mi djuno do co'a ralte lo se danti
2376768	jbo	sei mi djuno do ca'o ciska lo cukta
2376769	jbo	sei mi djuno do tom
2376770	jbo	mi djuno lo nu do se jenca
2376771	jbo	sei mi djuno do zernalfu'e
2376772	jbo	sei mi djuno do xagji
2376773	jbo	sei mi djuno do gleki
2376774	jbo	sei mi djuno do zerfu'e
2376782	jbo	certu jonai lazni
2376845	jbo	mi pu zukte pi roda si'unai
2376846	jbo	mi co'i si'unai zukte
2376847	jbo	mi pu zukte si'unai
2376848	jbo	mi retsku fi mi fe lo sedu'u fe makau mi co'i zukte
2376849	jbo	mi mo'u zukte ro da si'unai
2376850	jbo	la tom cu je'u na nelci do
2376854	jbo	lo vinji pu ca'o zenba co jibni la landyn
2376856	jbo	mi'ai co'i zukte ma
2376858	jbo	.au mi se frasybau
2376859	jbo	mi djica fe po'o lo nu mi kakne lo ka sipna
2376863	jbo	mi djica fe po'o da'i lo nu ko'a na tai kargu
2376870	jbo	sa'u mi gunka vi
2376873	jbo	la tom pu snada co sutra cpare lo tricu
2376875	jbo	mi na pu kakne lo ka na klaku
2377106	jbo	mi do na terpa
2377118	jbo	.a'o.i'i xagyti'a ca lo bavlamdei
2377125	jbo	lo vi cukta na sela'a lo verba
2377130	jbo	jetnu fa lo du'u ko'a morsi
2377145	jbo	mi pu sanji lo nu pu tolmo'i zo'e
2377247	jbo	lo vorme pu ganlo
2377378	jbo	mi'o pu klama tezu'e lo nu sombo
2377380	jbo	la .nin.smit. cu jisygau le va kumfa
2377391	jbo	ko'a kakne lo ka cusku je ciska bau la fasybau
2377399	jbo	mi'o pukfri lo nu zvati le xaskoi
2377403	jbo	lo cabna cu se tcika li rere .uedai
2377523	jbo	do bilga jo djica lo ka zvati ti
2377528	jbo	ko'a vudzu'e
2377543	jbo	le kagni cu zivle loi mutce jdini le gungunma
2377548	jbo	ti banli
2377560	jbo	lu'a ko'a pleji
2377677	jbo	ko'a djica lo ka sidju ko'e tu'a lo zdakemkulgu'a
2377696	jbo	mi xerskudji
2377709	jbo	ko'a ji'a ralte
2377713	jbo	sei na cumki do te vecnu lo ka gleki
2379633	jbo	mi xebni lo ka denpa tai zo'e bi'unai
2379636	jbo	mi xebni ro lo re do
2379637	jbo	mi xance te cpacu fi la tom fe lo dakfu
2379638	jbo	sei fasnu mi certu sazri prenu
2379639	jbo	mi naru'e se slabu do
2379640	jbo	mi xabni lo ka speni no da
2379641	jbo	mi xebni lo ka laldo
2379642	jbo	mi xebni ro da pe la tom
2379643	jbo	mi xebni ro nu do damba
2379658	jbo	mi xebni loi pe mi kalmebykre
2379659	jbo	.ei mi pu troci
2379666	jbo	.ei mi gunka
2379850	jbo	lo vi cidja cu xlacai .ije lo klani tai cmalu
2379852	jbo	ma lazme'e lo do patfu
2379853	jbo	ma lazme'e lo do mamta
2379858	jbo	xu lazme'e lo do patfu jo'u mamta fa lo mintu
2379859	jbo	ma cmene lo do mamta
2379860	jbo	ma cmene lo do patfu
2379863	jbo	ma se zvati la paris
2379866	jbo	xu le gerku cu me lo xekri
2379867	jbo	xu le gerku ku xekri
2379869	jbo	mi nelci lo lenku pitsa
2379872	jbo	mi nelci lo vi stuzi
2379879	jbo	lo fetsi ba xenru
2379880	jbo	do .io ba xenru
2379883	jbo	lo nakni ba xenru
2379884	jbo	lo gunma ba xenru
2379915	jbo	sei jalge lo fetsi pu zanru lo selti'i
2379916	jbo	sei jalge ko'a pu zanru lo selti'i
2379918	jbo	sei jalge lo gunma pu zanru lo selti'i
2379919	jbo	sei jalge lo nakni pu zanru lo selti'i
2379925	jbo	lo mi vudmenli mi raktu
2380528	jbo	mi xebni lo ka zgana lo nu do tai co'e
2382162	jbo	dukse pluja
2382163	jbo	dukse frili
2382189	jbo	do simlu lo ka pevglare
2382191	jbo	do simlu lo ka se pluka
2382192	jbo	ma pu spaji do
2382193	jbo	ma noi jmive pu spaji do
2382194	jbo	do simlu lo ka se skacu
2382195	jbo	ma pu cusku fi do
2382196	jbo	ma noi jmive pu sucku fi do
2382198	jbo	le jmive pe pu cu du ma
2382199	jbo	ma noi jmive pu co'e
2382200	jbo	ma pu se catra
2382201	jbo	ma pu zvati zo'e bi'unai
2382203	jbo	ma pu ciska ta
2382204	jbo	mo fa lo va nanmu
2382206	jbo	sei fatci mi na prami ta poi fetsi
2382209	jbo	ma basti do
2382211	jbo	lo'e ninmu pu nelci zo'e bi'unai
2382212	jbo	e'a do surla
2382214	jbo	e'a do stali
2382215	jbo	e'anai do cliva
2382218	jbo	ma pu zbasu ta
2382219	jbo	ma pu prami ma
2382221	jbo	ma ponse ta
2382222	jbo	ma pu rirni do
2382225	jbo	ma pu vimcu ta
2382228	jbo	ma pu cuxna do
2382232	jbo	mi ve ckule mu'i lo nu mi kaidji lo ka cilre
2382317	jbo	lo'i re nanmu cu tcesmisi'u
2382318	jbo	du'o le timnoi cu snime ca lo cabycte
2382353	jbo	lo nu le kalmari cu nilvifme'abi'o cu cfari
2382357	jbo	ckire do lo nu cpare lo tricu mu'i lo nu sidju mi
2382358	jbo	romi'a cikna
2382386	jbo	mi na ra'urselja'edji
2382405	jbo	ko'a se kanla zo'e pe lo patfu gi'e se nazbi zo'e pe lo mamta
2382413	jbo	mi do terpa
2382475	jbo	mi na kakne lo ka finti lo xauzma befi lo nu salci lo nu mi spenu'e lo xagrai pendo be mi
2382541	jbo	pu snuti
2382551	jbo	mi bajra le tcana gi'e .ue banzu clira
2382565	jbo	mi'o gasnu ma pe'ipei ca lo cnino kulcitsi
2383907	jbo	do zmadu nelci lo plise ji lo badna
2384202	jbo	ko'a mutci caucni ko'e
2384203	jbo	xu la .toki ponas. do bangu
2384208	jbo	la .meris. cu nelci lo nu selma'e lo xirma
2384218	jbo	lo tsani cu blanu
2384225	jbo	ko'a to'e zungi
2384231	jbo	xu la .tam. cu birti
2384339	jbo	mi na pu djuno lo nu ca vajni do
2384340	jbo	mi na pu djuno lo nu la tom cu se bruna
2384341	jbo	mi na pu djuno lo nu la tom cu ralte lo gerku
2384342	jbo	mi na pu djuno lo nu la tom cu mikce prenu
2384343	jbo	mi na pu djuno lo nu mi ca ca'o zukte makau
2384344	jbo	mi pu zukte da poi drani
2384345	jbo	mi pu zukte ro da poi mi kakne lo ka zukte
2384346	jbo	la tom cu me le xamgu traji gunka pe lo mi'ai kagni
2384348	jbo	ma se zvati le ninmu
2384349	jbo	ko sisti tu'a lo gapci
2384350	jbo	ko pofygau lo gapci
2384351	jbo	mi'ai pu cadzu fi lo jamfu
2384352	jbo	mi'ai pu co'a cadzu fi lo jamfu
2384353	jbo	ko'a zvati lo zdani vau xu
2384605	jbo	ko na curmi lo nu pilno lo skami
2384611	jbo	ko na cikre lo na'e spofu
2384633	jbo	mutce plixau
2384640	jbo	catlu mi
2384641	jbo	catlu do
2384654	jbo	ko darno
2385375	jbo	.i lo mabla kanpe cu cusku lu .i mi na ricfu li'u .i lo zabna kanpe cu cusku lu .i mi na'e ca ricfu li'u
2385381	jbo	la tom pu cusku fi mi
2385731	jbo	.i zukte lo semu'igi se bilga gi se zifre
2386334	jbo	mi na kakne lo ka zukte da
2386335	jbo	einai mi mulci lo kumfa pe mi
2386336	jbo	bu'u ma do pu tirna zo'e bi'unai
2386338	jbo	ko'a seltarbi
2386339	jbo	mi ralte lo cnino je xunre karce
2386340	jbo	mi ralte pa lo cnino ke xunre karce
2386342	jbo	mi djuno lo nu do djuno lo nu mi djuno
2387411	jbo	do melbi ninmu
2387412	jbo	bazi dunra
2387417	jbo	ko na cusku zo'e bi'unai la tom
2387852	jbo	lo tsani co'i carmi
2387857	jbo	la tom pujeca stace la maris
2387876	jbo	.a'i mi clira cikybi'o ca ro djedi
2387880	jbo	ko'a drani skicu lo fasnu bevi tu
2389031	jbo	.au mi pamei xabju lo kumfa
2389035	jbo	mi cinmo fi tu'a le gerku
2389040	jbo	mi cadzu mu'i lo nu .au menli surla
2389043	jbo	pe'i le karce na zbasu vi la dotygu'e
2390364	jbo	ca ma do cliva ti
2390365	jbo	mi na kakne lo ka sazri lo karce
2391251	jbo	la .tom. cu citka ca ro djedi su'o ci taslai poi rismi
2392608	jbo	le latmo bangu cu ckaji lo ka so'i da fleksio
2392609	jbo	mi vedli lo nu mi pu viska makau
2392610	jbo	mi birti morji tu'a la tom
2392611	jbo	mi vedli tu'a lo vi zgike
2392612	jbo	mi ca ca'o co'a morji
2392613	jbo	mi morji tu'a ro lo re do
2393401	jbo	mi pu xlura la tom lo ka sidju mi
2393403	jbo	mi termu'i lo ka jai clira
2393404	jbo	mi termu'i lo ka jinga
2393408	jbo	mi zgipli lo cmalu jgita
2393410	jbo	mi jo'u la tom cu kelci la baskedbol
2393411	jbo	mi nupre lo nu mi ba smaji
2393412	jbo	mi nupre lo ka na sanga
2393413	jbo	mi nupre lo ka troci
2393417	jbo	mi nupre fi do fe lo ka na za'ure'u zukte da bi'unai
2393425	jbo	ca ma do pu te vecnu le junla
2393427	jbo	ca ma do pu te vecnu lo do xance junla
2393428	jbo	ca ma do pu te vecnu lo vi xance junla
2393433	jbo	ko na renro lo jemna vi lo xarju
2393446	jbo	xu vasru su'o silna
2393447	jbo	ma ca'o fasnu
2393449	jbo	ma fasnu
2393452	jbo	ma co'i fasnu
2393454	jbo	ko ciska lo do cmene je lo judri
2397383	jbo	ko'a zu'edji lo nu spebi'osi'u ca lo bavlamdei
2397387	jbo	ko'a na ze'eba cikybi'o
2397393	jbo	loi pulji cu djica lo nu na xrani
2397402	jbo	mi do xelklasabji zo'e poi do kladji ke'a
2397404	jbo	.ibazibo lo cmalu temselfesti sidbo cu se pensi
2397405	jbo	mi na jimpe le ctununta'a be ko'a
2397408	jbo	ko'a klama la .nagoias. mu'i tu'a lo kagycu'u
2397421	jbo	le rivbi zerle'a cu pujeca na'e sispe'i
2397426	jbo	mi jinvi lo du'u to'e cumki fi'o ditcu pa djedi
2397590	jbo	do djuno lo du'u mi na kakne
2402714	jbo	ta me mi moi
2402716	jbo	lo xabju be lo bi'u nai cmatca cu ta'e kansi'u lo nu bevri lo narge me lo vo xance be lo re prenu be'o poi se tarmi lo julne mei li so'o
2409356	jbo	do ma cai pu zvati
2410661	jbo	gendra je ku'i to'e smudra
2412273	jbo	mi smitra lo ka gunka
2414249	jbo	ku'i lo ckafi cu xlali
2414273	jbo	la .tam. cu simsa do
2414288	jbo	la .tam. cu simlu lo ka se fanza
2414290	jbo	la .tam. cu simlu lo ka tatpi
2414293	jbo	la .tam. cu simlu lo ka se cfipu
2414295	jbo	la .tam. cu simlu lo ka fengu
2414298	jbo	la .tam. cu simlu lo ka milxe xanka
2414303	jbo	la .tam. cu viska lo loldi
2414308	jbo	la .tam. cu viska lo junla
2414310	jbo	la .tam. cu viska la .meris.
2414332	jbo	roda smaji
2414337	jbo	mulno smaji .i tirna lo nu lo pijne cu farlu
2414340	jbo	no lo prenu cu zvati
2415767	jbo	mi'a ca ricfu lo ka te vecnu lo cmalu po'o karce
2415768	jbo	e'u nai do citka lo na'e se jukpa cakcurnu
2415782	jbo	mi na djuno lo du'u lo mi ckiku makau zvati
2416645	jbo	tu'a lo fadni remna cu to'e cinri mi
2420295	jbo	ko vi xruti
2424072	jbo	.ia drani
2428305	jbo	re do mi serai pendo
2431842	jbo	mi nei sanji
2431853	jbo	ko catlu si'unai
2431895	jbo	ei na xaksu lo jdini
2433584	jbo	mi ladru za'umei djica
2435552	jbo	lo me lo tsani mei cu na'e banzu lo ka te ciska lo se du'u mi do prami
2436970	jbo	ta'i ma lo pe mi pindi ke cmalu besna ka'e ba jimpe lo nu do pu skudji makau tai da bi'unai
2436971	jbo	ko'a na djica lo nu lo za'u do djuno
2436972	jbo	ko'a na djica lo nu lo pa do djuno
2437414	jbo	a'ucu'i loi skina
2439190	jbo	ei do mo'u morji lo vi jufra
2439194	jbo	xu do se bangu la uigur
2439195	jbo	ei za'u mi citka
2439197	jbo	ko'a se bangu nai lo pe mi bangu
2439200	jbo	lo za'u ra pu retsku fi la misis linkoln fe lo se du'u ri djica lo nu lo speni be ri cu se derni'agau bu'u makau
2439220	jbo	lo'e ricyratcu cu citka lo xazlenu narge
2439221	jbo	mi jimpe tcidu lo glico i ku'i mi kakne nai lo ka tavla ri
2439222	jbo	.au mi retsku fi do fe lo se du'u mi zukte makau zo'e bi'unai
2439223	jbo	sei .au mi fi do retsku makau se zukte fi zo'e bi'unai
2441805	jbo	lonu mi zenba cpacu kei selja'e lonu mi zenba djica .i lonu mi zenba djica kei selja'e lonu mi jdika cpacu .i lonu mi jdika cpacu kei selja'e lonu mi jdika djica .i lonu mi jdika djica kei selja'e lonu mi zenba cpacu
2442054	jbo	xu do ralte lo cartu
2442056	jbo	do ralte lo cartu vau xu
2442062	jbo	do me lo pe mi solri gusni
2442064	jbo	do me lo pe mi solri
2445617	jbo	le ninmu ku fonta'a mi ra'i la.tokion.
2445648	jbo	le nanmu ku nelci le ninmu
2446674	jbo	le nanmu na mikce
2448931	jbo	lo pluka ko li'i sipna
2448937	jbo	fe ma do pu viska
2448938	jbo	seja'e ma lo prenu cu catra lo nei
2450719	jbo	mi djica lo ka litru ka'ai do
2450720	jbo	mi djica lo ka ka'ai do litru
2452804	jbo	do .e'i tavla bau lo fraso vi
2452805	jbo	.e'i mi klama tezu'e lo ka penmi la tom
2452807	jbo	.e'i mi penmi la tom
2452812	jbo	ko sisti lo ka cusku lo se bebna
2456831	jbo	ko’a fapro lo nu gunta fa lo jenmi ije ko’a na’e fapro lo nu gunta fa lo sidbo
2456840	jbo	la tom cu ctuca fi lo fraso fe lo verba
2456842	jbo	la tom cu kakne lo ka sanga su'o so'o lo fraso selsanga
2456843	jbo	mi se slabu lo prenu noi se frasybau
2456845	jbo	ckire fi lo ka sidju mi
2456847	jbo	mi no da se ke fetsi pampendo
2467931	jbo	mi'ai ma zukte ca lo nu do ti mo'u tsuku
2467936	jbo	mi na xabju la torinos
2467986	jbo	ko na troci co dukse carmi
2468089	jbo	.i lo troci ku po'o snada .i ku'i lo troci po'o ku fliba
2468098	jbo	mi djuno lo nu vi makau la tom cu mipri lo pe ri jdini
2469697	jbo	.i le sfaile cu pi'ai megdo skamrbaiti li 7
2469699	jbo	.au zirsmela pesxu
2469703	jbo	mi djica tu'a lo flaume pesxu
2469707	jbo	za'u mi tavla fi lo mintu secu'u sa'u lo frica valsi
2469711	jbo	e'o mi ciksi lo nu mi te smuni makau
2470125	jbo	ca'e gusni
2470185	jbo	da bi'unai jai pu mo
2472018	jbo	.i no da nu surla fa lo palci
2472022	jbo	mi jinvi lo nu za'u mi ba jai lerci
2472061	jbo	lo tsani pu tarci ckaji je cu carmi i tai bo fau lo nu da catlu ty vau da co'a retsku fi lo nei fe lo se du'u xukau lo se ke xlali je cunso cnitcini ke'e prenu ka'e xabju ni'a le tai tsani
2472194	jbo	do na ba morsi vau je'u pei
2472201	jbo	dukse ke cunso ckape
2472205	jbo	ko zandapma mi lo ka xamgu
2472209	jbo	lo lorxu lo korvo cu zmadu lo ka ticprije
2472212	jbo	mi da bi'unai ca'o co'a se pluka
2472215	jbo	lo bruna be mi ca zvati la Australias
2472217	jbo	caku ba'e do sanga ko'oi
2472976	jbo	ko cusku fi mi fe lo se du'u ca makau mi sisti
2472979	jbo	mi pu vimcu lo pe mi cmene lo liste
2472980	jbo	mutce ckaji lo ka verba
2472989	jbo	ma fu'esku do
2472991	jbo	mi denpa tu'a lo pendo be mi
2472998	jbo	ko'a se pluka sidju puku za'u mi
2473046	jbo	mi pu djuno nai lo nu lo karce pe la tom pu se zerle'a
2473075	jbo	vi lo tanbo pu sanli fa lo nixli noi lo flira zo'u darsi cmila
2473084	jbo	la tom pu firca la djabeini'u
2473097	jbo	le se datni cu trina so'i da
2473099	jbo	do carmi gunka
2473102	jbo	la tom nasai sezyselfu
2473106	jbo	da bi'unai xagrai tadji lo nu danfu facki
2475197	jbo	mi nupre lo nu mi ba xruti pleji lo se dejni do
2475329	jbo	lo mlatu cu sipna bu'u lo jubme
2480494	jbo	.i lo crisa cu citsi lo ka glare dukse fi lo ka lo dunra cu dukse lo ni lenku kei ce'u
2480495	jbo	.i lo crisa cu citsi lo ka glare dukse fi lo ka te dukse be lo ni lenku kei lo dunra
2480496	jbo	.i da zo'u lo crisa fa'u dunra cu citsi lo ka glare fa'u lenku dukse fi da
2480518	jbo	mi pu zukte tai lo nu se stidi fi mi
2480520	jbo	mi pu zukte lo nu se cpedu fai mi
2480540	jbo	la tom pu zerle'a fi mi
2480546	jbo	mi mulno nalmorji tu'a la tom
2484531	jbo	ko sidju mi
2484796	jbo	.i lo kukte do jai li'i citka
2485123	jbo	le mi kerfa cu cilmo
2485694	jbo	pluka jeftyfanmo di'ai
2485695	jbo	sai pluka jeftyfanmo di'ai
2486272	jbo	lo jbobau ca'o jmive i ki'u po'o bo lo jbobau nabmi ca'o zasti
2487741	jbo	mitre be li ni'u ci gei su'e mu
2487940	jbo	le profesoro pu na kakne lo nu jimpe lo nu mi te smuni makau
2487941	jbo	na se smuni fi mi
2487961	jbo	mi manci lo nu bau lo za'u slovo bangu lo valsi be lo titla tasta ca lo cfari pu valsi lo silna tasta vau sai
2487978	jbo	fi mi zo maik poi mi pu cusku cu smuni je'u zo maik poi cmene lo gerku pe mi
2488127	jbo	mi no mu'ei speni do
2490244	jbo	do banzu lo ka plipe fo makau
2490249	jbo	do banzu lo ka plipe fo makau kei lo nu pencu lo va tricu jimca
2490965	jbo	.ai mi ba co'a cmoni
2491011	jbo	lo bolci pe lo verba cu pu farlu ne'i lo cmari'e
2491021	jbo	ju'i do .i do jai gau mo
2491022	jbo	mi na se cmene la tam.
2491023	jbo	mi nelci la tokis. ponas.
2491025	jbo	xu do se bangu la tokis. ponas.
2491026	jbo	xu do kakne se bangu la tokis. ponas.
2491028	jbo	mi cilre la tokis. ponas.
2491853	jbo	ca'e mi pamoi klama
2491945	jbo	do zvati ta'i ma
2492144	jbo	ju'i do'u do mo
2492283	jbo	lo vi gerku ku barda
2492718	jbo	.i mi ba vi zvati ba lo jai se cusku za lo cacra be li re
2492723	jbo	.i mi ba vi zvati pu lo jai se cusku za lo cacra be li re
2499192	jbo	mi pu klama to'o la nipon za lo nanca be li vo semu'i lo ka stali ze'a lo nanca be li pa
2499193	jbo	la degas pu jbena za lo nanca be li za'u pamuno
2499194	jbo	pu fasnu za lo nanca be li so'u pa
2499195	jbo	pu jamna za lo nanca be li 45
2499196	jbo	le ninmu pu muvdu ti za la masti be li pa
2499197	jbo	lo vi gerku pu jbena za lo masti be li re
2499198	jbo	ti du le junla poi mi pu cirko za lo jeftu be li pa
2500718	jbo	.e'a do cliva
2500719	jbo	mi tirna lo nu zo'e ki'asku
2502440	jbo	doi ma
2504763	jbo	.i lo nei troci cu bebna
2505908	jbo	la .tokis. ponas. cu xamgu fi mi
2505955	jbo	.ue cu'i
2505956	jbo	mi pu co'i penmi la .tam.
2505958	jbo	mi pu penmi la .tam.
2509715	jbo	na vajni mi fa lo nu do jdice lo ka te cmene mi makau
2509727	jbo	coi do do co'i citka xu
2509731	jbo	xu da pu viska do
2509738	jbo	mi xebni lo ka gunka
2513762	jbo	da me lo se gunka noi .ei zukte
2514131	jbo	mi citka lo badna ku po'o
2514132	jbo	ro lo selcti be mi cu badna
2518075	jbo	na'e selspaji
2519760	jbo	pu se bersa ci da noi binxo lo flacre
2519763	jbo	da pu nenri lo zdadi'u
2519766	jbo	zukte lo se nupre be lo no'a
2519770	jbo	jbena djedi ke kansa gleki
2519777	jbo	lo solri pu glare ije lo za'u ko'a pu tatpi
2519783	jbo	la tom cu lacri da naku
2519784	jbo	la tom cu lacri no da
2519789	jbo	lo mi bruna cu ga'orgau lo kanla ca lo ka pinxe
2520532	jbo	ko'a blabi
2520533	jbo	za'a .a'udai pei
2521281	jbo	ko'a cargau lo jubme ja'e lo nu gapnitfa'e
2521285	jbo	ko'a gapnitfa'egau lo jubme
2521315	jbo	lo sanmi pu kukte mutce ja'e lo nu mi citka lo duslai
2521325	jbo	lo djedi ca'o masno .oi prubi'o
2521352	jbo	lo djedi cu malsno prubi'o
2522356	jbo	.ai mi cmoni
2522779	jbo	.ua
2522813	jbo	xu xagji
2526130	jbo	to'u ro lo se troci be mi'ai pu se jalge no da
2526137	jbo	to'u ko'a me lo nanmu poi kakne lo ka se banli
2526176	jbo	do gunka co mutce carmi i ko ze'i surla
2526178	jbo	o'i da barda kevna va
2526181	jbo	ko febgau lo djacu
2526182	jbo	e'u mi'o pinxe gi'a zukte lo simsa
2526184	jbo	ko jungau mi lo du'u mu'i ma do pu nalzvati lo ckule ca lo prulamdei
2526186	jbo	e'i pensi lo pendo
2526305	jbo	ti'u ma do pu co'a cikna
2526308	jbo	mi djica tu'a lo zdani
2526311	jbo	mi djica lo ka klama lo zdani
2526313	jbo	vi risna mi
2526316	jbo	la tom cu rirpa'u la maris
2526319	jbo	ma jdima lo vi junla
2526326	jbo	ti nalcumki kargu
2526328	jbo	ti mutce kargu
2526341	jbo	do ka'e tervecnu ma bu'u lo zarci
2526343	jbo	ma ka'e se vecnu bu'u lo zarci
2526427	jbo	xu do djuno lo du'u makau ralju tcadu la belgium
2526432	jbo	lo vi za'u pixra cu melbi
2526437	jbo	lo vi so'o pixra cu je'a melbi
2526441	jbo	lo vi za'u kacmyxra cu me lo mutce melbi
2528552	jbo	mi djica loka po'o djuno lo du'u ma ca'o fasnu
2529724	jbo	me le fasnu baza lo cacra be li pa
2529725	jbo	mi'ai zukte fi da bi'unai
2529727	jbo	mi pu tirna lo nu ko'a ca'o sanga
2529830	jbo	lo tcati cu jdika lo ni glare kei ri'a tu'a lo lenku vacri
2529839	jbo	ua bu'o je'e
2529847	jbo	lo mi laldymau bruna cu mutce ricfu
2529849	jbo	ra me lo melbi ninmu
2529850	jbo	ra me lo noi melbi vau ninmu
2529851	jbo	ra melbi ninmu
2529852	jbo	ra me lo ninmu noi melbi
2529853	jbo	ko'a me lo sutra cadzu
2529860	jbo	ma se zvati lo be do kanla
2530032	jbo	do melbi sai
2530680	jbo	bazi vensa
2531549	jbo	ko na gletu ko'a mu'i po'o lo nu do djica
2531550	jbo	ko gletu ko'a mu'i lo nu do cinbi'abi'o da'i kei naku
2532322	jbo	mi na jimpe zo'ei lo nu do cusku
2532338	jbo	da bi'unai tai se badri
2532384	jbo	ko dunda ra mi
2532385	jbo	ko dunda fi mi
2532387	jbo	ko dunda fi mi fe ra
2532403	jbo	ro lo prenu tai cusku
2533737	jbo	baziku do se tcaci lo ka si'unai selzda
2533738	jbo	viba'oku cripa
2533741	jbo	mi pu jinvi lo du'u la tom mi pendo
2534587	jbo	.i mi nelci lo melbi ju santa
2534589	jbo	mi ba klama giju carvi ca lo bavlamdei
2554298	jbo	.e'o do jukpa lo snuji fi'o te dunda mi
2554299	jbo	.ue sai melbi
2554442	jbo	mi penmi zu'i zu'i
2554482	jbo	lo nu mi bajra cu zmadu ro drata be vo'a lo ka mi prami
2558052	jbo	mi puki co'a mutce tatpi .i ku'i mi kufra
2558075	jbo	mu'i ma da se vajni lo nu ca ko'a spebi'o
2558091	jbo	ma cmene ko'a
2561208	jbo	ko nicygau lo jubme
2561214	jbo	ko xruti lo jubme lo ka cnici
2570972	jbo	lo ka na'e drani co mokau cu filrai
2570993	jbo	no da ei sidju i ca'aku noda sidju
2570998	jbo	la tom na ca'o xalbo
2572577	jbo	seja'e ma do pu bajra to'o
2572583	jbo	to'u le nunpenmi pu ka nalprali xaksu lo temci
2572586	jbo	sei lakne la tom ba snada tu'a lo cabdei cipra
2572588	jbo	sei lakne la tom ba snada tu'a lo cabdei eksameno
2572591	jbo	ko cpare doi cakcurnu lo salpo sefta be la fudzi cmana seka'a lo serai galtu
2572596	jbo	doi cakcurnu fe lo salpo sefta be la fudzi cmana ko cpare co masno .o'odai
2572649	jbo	.ei sutra zmadu frati
2572660	jbo	ko tadni lo bangu fi'o se pleji no da
2572684	jbo	mi xebni lo nu zgana ro nu do se tasmi lo simsa
2572810	jbo	la djon pu dukse lo ka se spaji kei lo ka cusku da
2572811	jbo	mi pu frati fi la tom tai lo nu ri pendo
2572812	jbo	banzu fa lo dei nu tavla
2572815	jbo	lo vinji pu klama ti'u lo se platu
2572816	jbo	lo vinji cu cnano tcika klama co'i
2572822	jbo	ca ro nu mi viska do kei mi pensi lo be mi patfu
2572827	jbo	nolcladu trili fa lo grilida
2574636	jbo	vi ma la jim.
2575393	jbo	mi pu co'u se jibri za lo djedi be li re
2575396	jbo	mi co'u se jibri ca lo pruprulamdei
2575398	jbo	ca ma la tom pu co'a se speni
2575401	jbo	do zutse e'o vau sei ra pu cusku
2575406	jbo	mi kucli lo nu xukau do tolcando du'i mi
2575408	jbo	ma bangu do doi tom
2575410	jbo	xunai ra selpluka
2575411	jbo	mi na djica lo ka klama da
2575412	jbo	la tom pu co'a gleki
2575414	jbo	la tom pu cinmo lo ka xamgu
2575416	jbo	ko stali ze'i
2575417	jbo	lo nunji'e cu banli
2575418	jbo	ra pu kalsa
2575419	jbo	mi se speni no da
2575420	jbo	mi na pulji
2575422	jbo	mi ba sisti do
2575425	jbo	mi ba citka lo finpe
2575426	jbo	mi ba ku lo finpe
2575427	jbo	mi lo finpe ba
2575428	jbo	au mi djuno da'i
2575429	jbo	mi djica ro ra
2575430	jbo	mi pu cusku fi la tom fe zo'ei naku
2575432	jbo	mi pu cirko lo mi mapku
2575433	jbo	mi nelci lo mi patfu .iu
2575434	jbo	tai sai kukte
2575436	jbo	ca'e do zutse va
2575437	jbo	mi'ai xabju vi
2575438	jbo	ko denpa bu'u le bartu
2575439	jbo	ra pu xlali
2575440	jbo	sa'u ko cusku zo ie
2575441	jbo	pu cmalu
2575442	jbo	mi ba ralte ra
2575443	jbo	za'u ra pu zukte da bi'unai
2575444	jbo	seva'u mi'ai
2575445	jbo	se bebna
2575450	jbo	xu mi'ai ka'e zukte da bi'unai
2575453	jbo	do djuno da bi'unai
2575454	jbo	do pu tcica
2575455	jbo	za'u ra xunre
2575459	jbo	mi pu'o fonta'a la tom
2575461	jbo	mi senpi lo nu le fetsi cu prami do
2575470	jbo	seja'e ma la tom cu cilmo
2575473	jbo	la tom pu dasni lo mapku
2575500	jbo	la tom na pu bajra
2575501	jbo	za'adai jibri mi
2575504	jbo	ti jbama
2575506	jbo	ti se dunda
2575509	jbo	mi na tai laldo
2575510	jbo	mi na cifnu
2575511	jbo	mi milxe lerci
2575514	jbo	mi gunka bu'u lo zdani
2575517	jbo	mi pu dukse lerci
2575521	jbo	mi pu bebna
2575528	jbo	mi so'ire'u litru
2575531	jbo	mi xebni lo ka'orta
2575532	jbo	lo nu dansu cu zdile
2575534	jbo	mi na ralte lo cidja
2575539	jbo	do kurji vi'opei
2575543	jbo	do simlu lo ka tolmelbi
2575545	jbo	do djuno ra
2575547	jbo	ma ca'o fonta'a
2575550	jbo	la tom pu jgira
2575552	jbo	la tom pu se tolzdi
2575553	jbo	la tom cu nelci do
2575555	jbo	la tom cu ralte lo lanme
2575556	jbo	la tom pu se jibri da
2575558	jbo	la tom pu ralte lo gerku
2575560	jbo	la tom pu ralte lo mlatu
2575570	jbo	lo ckule cu na jai zdile
2575575	jbo	pu na xajmi selsku
2575576	jbo	pu makfa
2575578	jbo	mi birti ra
2575581	jbo	mi bredi lo ka co'a morsi
2575582	jbo	mi jgira tu'a la tom
2577815	jbo	mi birti da bi'unai
2577816	jbo	mi na simsa la tom
2577817	jbo	mi na cmima
2577818	jbo	mi cortu vi
2577819	jbo	mi ca bu'u lo mi briju
2577820	jbo	mi vi zvati tezu'e lo ka stali
2577821	jbo	mi gleki lo ka sidju
2577822	jbo	mi bu'u lo dinju
2577823	jbo	mi bu'u lo xotli
2577824	jbo	mi lebna ra ca
2577826	jbo	da'i mi stali iu
2577827	jbo	da'i mi na zukte tai
2577829	jbo	mi na ba smaji
2577830	jbo	ca da mi pu citno
2577832	jbo	mi pu taisai birti
2577834	jbo	mi pu dukse terpa
2577835	jbo	mi pu zvati lo karce
2577836	jbo	kai mi pu jitro
2577838	jbo	gau mi mi pu ca'o se zdile
2577841	jbo	pu ca'o zdile mi
2577842	jbo	au klama lo bartu
2577843	jbo	mi nitcu lo jetnu
2577845	jbo	mi pu denpa tu'a la tom
2577846	jbo	mi pu denpa ze'a lo cacra be li pa
2577847	jbo	mi pu tirna lo nu camki'a
2577848	jbo	mi tai seicni
2577851	jbo	ro da pu se zdile
2577852	jbo	xu la tom pu cortygau do
2577856	jbo	do me lo ninmu pe mi
2577858	jbo	do me lo mi bradi
2577860	jbo	do me lo mi panzi
2577862	jbo	do ba tolcri pa da
2577863	jbo	do ca'a se jenca
