4333660	jbo	la tom na zvati lo briju
4333661	jbo	mi citka
4333662	jbo	be'u mi sipna
4333663	jbo	ti briju mi
4333679	jbo	li rexa pi'e pa pi'e renopano detri lo prulamdei no'u lo reldei
4333688	jbo	mi sigva'u
4333691	jbo	pei.ei mi cilre
4333699	jbo	mi cuxna la tom
4333700	jbo	ti briju la tom
4333701	jbo	ko jarco fi la tom
4333703	jbo	lo cabdei cu pavdei
4333704	jbo	pu mutce manku
4333705	jbo	lo cabdei cu zeldei
4333706	jbo	ca'o xavdei
4333709	jbo	xu do ta'e damva'o
4333710	jbo	xu do se panzi
4333711	jbo	mi na ta'e damva'u
4333713	jbo	.e'o ko na klaku
4333714	jbo	mu'ima lo cifnu cu klaku
4333715	jbo	lo bavlamdei cu zeldei
4333716	jbo	lo cifnu cu sipna
4333717	jbo	ko'a mutce nelci lo'e verba
4333718	jbo	le'e mlatu cu xebni loi djacu
4333719	jbo	lo'e mlatu cu kavbu lo'e smacu
4333720	jbo	la patfu cu zvati ma
4333721	jbo	lo rirmamta be mi cu masno tavla
4333722	jbo	ko'a ctuca
4333723	jbo	lo mamta be la tom cu pu klaku
4333727	jbo	mi nelci le'e mlatu
4333728	jbo	ko'a nelci le'e mlatu
4333734	jbo	lo mamta be mi cu nelci le'e zgike
4337259	jbo	li pa .e li ci .e li mu nalreldilcymu'o
4337260	jbo	da prami rode
4337261	jbo	noda ponse la lunra
4337262	jbo	la'o gy.Abraham Lincoln.gy. misno prenu
4337263	jbo	li pa su'i re du li ci
4337264	jbo	lo mlatu cu cpana lo matci
4337265	jbo	lo'e cribe cu ka'e cpare lo'e tricu
4337266	jbo	mi na se bangu la ponbau
4337267	jbo	la paRIS tcutca la fasygu'e
4337268	jbo	la'o gy.Lee Leffingwell.gy. jatna la'o gy.Austin City Council.gy.
4337269	jbo	da poi ke'a ridrxobi zo'u la zauron djica lo nu roda terpa tu'a zy.
4337270	jbo	lo'e plise cu xunre gi'a crino
4337272	jbo	lo'e plise cu xunre gi'onai crino
4337273	jbo	la mumplin traji lo ka junta lo ka zmadu lo'i plini pe la tarci'e
4337274	jbo	lo'e mudyctijalra cu nelci lo za'i citka loi mudri
4337275	jbo	lo mudri stizu cu kargu
4337276	jbo	lo citno nanmu cu mikce
4337277	jbo	lo cifnu cu nitcu lo mamta be vo'a
4337291	jbo	roda poi ke'a plise cu xunre
4337292	jbo	la betmyn pendo la robin
4337294	jbo	li ki'oki'o lo'i prenu cu nilxa'ugri la'o gy.Auckland.gy.
4337299	jbo	la madonas pu'i sanga
4337301	jbo	la madonas kakne lo nu sanga
4337307	jbo	la'o gy.Auckland.gy. tcadu fi la gugdenuzu
4347477	jbo	le junla cu te tcidu lo tcika be lo lerci
4347483	jbo	lo va junla cu te tcidu lo tcika pe baza lo mentu be li pa
4347484	jbo	lo mi junla cu te tcidu lo tcika pe baza lo mentu be li re
4347485	jbo	lo mi junla cu te tcidu lo tcika pe baza lo mentu be li 5
4347502	jbo	le pa sinxa junla cu te tcidu lo tcika pe baza lo mentu be li 10
4347508	jbo	no da cmene mi
4347522	jbo	o'anai no da bersa mi
4347751	jbo	na ka'e se gugle
4348178	jbo	le junla cu julbaco
4348179	jbo	le meta junla cu julbaco lo mentu be li pa
4348180	jbo	le mi junla cu julbaco lo mentu be li re
4348181	jbo	le mi junla cu julbaco lo mentu be li mu
4348285	jbo	le cikyjunla cu julbaco lo mentu be li pano
4348289	jbo	le meta junla cu julpuco
4348290	jbo	le junla cu julpuco lo mentu be li pano
4348292	jbo	ei do galfi le junla .i ri julpuco
4355593	jbo	mi ca'a jorne
4355596	jbo	xu do ca'a jorne
4355599	jbo	ca lo cabdei mi jorne
4355604	jbo	mi pu penmi le nakni tai lo nu kibro jorne
4366656	jbo	.aicai mi ba skepre
4366657	jbo	xu do djuno lo du'u mi krici lo du'u makau ca fasnu viku
4366663	jbo	mi pu ba'o cunso penmi lo slabu pendo lo dargu
4366664	jbo	mi pu karbi lo ti pixra lo ti pixra
4366666	jbo	pe'isai do ba nelci la tom
4366669	jbo	.a'o la tom zabna tarti
4366676	jbo	la tom jo'u la meris pu ba'o cadzu cliva
4366696	jbo	ru'a ko'a ca denpa va lo renytcana
4366698	jbo	mi'a xagji
4366700	jbo	ko'a xebni ko'e
4366701	jbo	.u'unai
4366702	jbo	lo'e tabra cu zgitci
4366704	jbo	mi'a pu citka lo so'e plise
4366705	jbo	tolzdi
4366710	jbo	lo nu zvafa'i ko'a cu na nandu
4366712	jbo	.ai fi mi preti fo la tom
4366713	jbo	.e'uro'o ko na damva'u
4366714	jbo	lo du'u makau rinka lo nu fagri cu na se djuno
4366715	jbo	do simsa ma poi ke'a rirni do
4366717	jbo	lo'e prenu na nitcu lo nu tcidu roda
4366720	jbo	zo tom cmene mi .e do
4366722	jbo	.ai mi ba kensylitru
4366728	jbo	lu pamei je'i remei farna li'u co'e .i lu .e'o jenai li'u co'e
4370740	jbo	le fetsi pu benji lo be ri bersa te zu'e tu'a lo mikce
4370831	jbo	le nanmu cu se bangu pa da po'o
4371321	jbo	mi fliba lo ka sipna i sa'u mi entuzi lo ka djuno fi lo ma'a nu ba zi kuspe la pluton
4371515	jbo	la xavax pu crepu lo grute le tricu pe lo se djuno
4371516	jbo	lo cifnu na jimpe lo te frica be lo xamgu bei lo xlali
4372328	jbo	mi dimnu'e lo du'u jetnu kei lo ka lindi ce'u
4373358	jbo	lu xu la kukis gerku gi'a mlatu li'u co'e .i zo go'i co'e
4373360	jbo	lu xu la kukis gerku gi'a mlatu li'u co'e .i lu na go'i li'u co'e
4373385	jbo	lu xu do nelci mi li'u co'e .i zo go'i co'e
4373407	jbo	mutce jitfa
4373419	jbo	la'apei do dukse gunka
4373420	jbo	mi te cange
4373458	jbo	lo rirni be mi cu zvati ma
4373464	jbo	ko'a pu di'a tcidu lo cukta
4373469	jbo	mi zenba lo ni junta
4373472	jbo	ko'a fengu
4373478	jbo	lo ti cladakyxa'i cu cizra se citri
4373482	jbo	pe'i la esperanton mutce vajni
4373483	jbo	mi puba'o fengu
4373493	jbo	ma te jinga
4375662	jbo	mi pu jinvi lo du'u do xagji
4375666	jbo	la .tom. cau'a smusku lo jetnu
4375670	jbo	ja'aku ja naku la .tom. cu smusku lo jetnu
4377513	jbo	lo'e bebna poi ke'a ponse lo tutci cu ba'e bebna
4377524	jbo	noda djuno fi lo danfu
4377527	jbo	la terdi cu mo'u zasti ca ma
4377528	jbo	ne'i la gligugde roda poi ke'a na se tolcru cu se curmi
4380599	jbo	mi na verntineidja
4380601	jbo	la tom za'o verntineidja
4380602	jbo	mu'ima lo ta verntineidja cu cmila
4380605	jbo	le'e verntineidja cu nelci lo nu samyzilkeikei
4380606	jbo	pa lo verntineidja cu pu krixa
4380610	jbo	lo karni cu karni fo lo'e verntineidja
4380612	jbo	lo bersa be mi cu fapro verntineidja
4380616	jbo	lo verntineidja cu pu ba'o cliva
4380617	jbo	la tom verntineidja
4380618	jbo	mi se panzi lo ci verntineidja
4380620	jbo	la emilis verntineidja
4380629	jbo	do puzuba'o verntineidja
4380631	jbo	ta karni fo le'e verntineidja
4380636	jbo	do pu'o verntineidja
4380637	jbo	la tom puba'o verntineidja
4380642	jbo	le'e verntineidja nanla cu nelci lo nu samyzilkeikei
4380732	jbo	plixau uidje
4387550	jbo	mi pu dansu ca lo prulamdei .i mi go'i pu ji'a lo prulamdei
4411042	jbo	ko'a prami ko'e e mi
4412212	jbo	me'o FVD sinxa lu fange ke vofli dacti li'u
4412224	jbo	xu do pu'i viska lo fange ke vofli dacti
4412245	jbo	ma du VFD
4412247	jbo	mi pu viska VFD
4412250	jbo	simlu lo ka du VFD
4412252	jbo	xu do pu'i viska VFD
4412272	jbo	mi pu viska VFD ca lo drata
4412273	jbo	la tom nu'o viska VFD
4412276	jbo	xu do pu je'a viska VFD
4412665	jbo	mi xebni lo'e se sitsku .i ko jungau mi lo poi'i ba'e do djuno
4414251	jbo	e'apei mi vitke ca le bavlamdei ku ji'a
4414588	jbo	xu le karce cu simlu lo ka laldo
4414593	jbo	lo'e nu nitcu cu pe'a mamta lo'e nu finti
4414598	jbo	su'o da jai se gleki fai lo ka darca .ije su'o de go'i fai lo ka cliva
4414608	jbo	no da snada ne'i le munje secau lo ka gunka
4416653	jbo	ro remna cu se cfila so'i da noi jai sarcu fai lo ka se dragau
4417142	jbo	mi na djuno lo du'u ca makau la .tom. cu erve le metu vlacku
4419570	jbo	ko troci lo nu cilre lo xo'e gerna
4419572	jbo	do dotco xu
4423640	jbo	le mlatu cu ponse re lo kerlo
4423644	jbo	mi ve balcu'e
4423649	jbo	ko'a ricfu nagi'enai misno
4423665	jbo	mi djica tu'a lo cladakfu poi simsa ti
4423673	jbo	le citni'u poi cnita le tricu cu simlu lo ka badri
4423729	jbo	do trajynei ma lo boltipgrijvi
4423738	jbo	la .tom. ba'o zu'ejdi lo ka ce'u klama
4423745	jbo	va'i ko'a traide tu'a mi'ai
4423746	jbo	mi pu na djuno lo du'u ko'a zvati
4423747	jbo	la tom ca na seljibri
4423748	jbo	mi jai zu'e kajde ko'a le ckape
4423883	jbo	da specfari'i za'u ko'a de'i li pa
4423962	jbo	ca'o lanli
4423987	jbo	ro le sivni be za'u ko'a cu se to'e mipri
4424373	jbo	mi'ai pu snada lo nu ce'u limna be mo'i pa'o le rirxe
4424751	jbo	ro lo remna goi ko'a ca lo nu ri co'i jbena cu zifre gi'e dunli be lo ka ce'u se vamji be fo lo ka sinma .e lo ka ce'u se prezi'ejva .i ko'a te dunda fi zi'o fe lo ka menli .e lo ka marde .ije .ei ko'a simxu jikca sekai le ka bruna
4425188	jbo	ta misno merko ckufi'i
4425194	jbo	la maris. cu fetspe mi
4425203	jbo	so'i da prali fi lo za'i ce'u melbi
4425253	jbo	so'i da prali fi lo ka melbi
4425649	jbo	mi birti lo du'u mi prami ra
4425721	jbo	le klaji cu manku
4425725	jbo	doi tom. ko dafsku
4425762	jbo	ganai da carvi ca lo bavlamdei ginai mi klama
4425770	jbo	do pu su'oroi cusku do'i mi
4425774	jbo	mi mutce caucni ti
4425781	jbo	xu do jimpe fi le se srera be do
4425898	jbo	mi jinvi le du'u za'u ko'a pu viska mi
4425908	jbo	mi na jimpe fi za'u ko'a
4426367	jbo	mi cinmo lo ka tolmle
4426368	jbo	mi tolmle
4428109	jbo	mi pu djica lo nu mi tavla do ti
4428329	jbo	ma cusku fi do fe ti
4428352	jbo	mi sreselbandu lo zumri
4428359	jbo	do djuno lo du'u mi drani
4428383	jbo	le fetsi cu kakne lo nu zabna tavla fo lo glico
4428483	jbo	pa le verba pu retsku de'i da lu ma krasi lo cifnu li'u
4428668	jbo	le karce na klama co sutra
4428697	jbo	ki'u ma do pinxe lo djacu
4428721	jbo	ko cinmo lo ka zdazva
4428724	jbo	ko sipgau le cifnu
4428745	jbo	le glico gugyka'i cu pu camcpe lo nu ri tolka'i penmi le gugja'a
4428989	jbo	le kagni pe mi'a ca le nu ri cfari pu le'ipli xa po'o lo seljibri
4429023	jbo	mi prami le bangu
4429028	jbo	ko'a poi ke'a ji'efri secau lo ka ce'u bebna cu prije seme'a lo ni ko'a jinvi lo du'u nei
4429034	jbo	lo gerna cu mutce nandu
4429049	jbo	lo'e poi'i rivbi lo ka bebna cu jai mleca fai lo ka prije kei lo jai se jinvi be vo'a
4429099	jbo	lo nu se bebna kei claxu jmive na tankomo lo ka prije kei lo ka jinvi
4429173	jbo	le mradi'u cu melbi
4429188	jbo	ma stuzi lo me la .xakatas. me'u tcana
4429466	jbo	le pelji ctikabri cu tolkargu
4429899	jbo	mi djica lo nu mi tadni le glibau
4429915	jbo	le bruna pe mi cu dunda lo bambola nei dibmle mi
4430165	jbo	le purmo cu ka'e runta lo djacu
4430194	jbo	la tom. cu xamgau tu'a do
4430380	jbo	mi te ctipla .i mi ju'odji le jei lo nu citka be lo cakla cu rinka lo nu plana
4430525	jbo	ca'e lo nu nalzi'e co'a catni se nalzi'e
4430545	jbo	lo nazbi po'e lo'e gerku cu mutce ganse
4430815	jbo	mi mutce gleki lo nu mi viska do
4432289	jbo	da'i mi cusku tai lo mintu
4432634	jbo	mi troci
4432637	jbo	.oi
4432639	jbo	.a'onai
4432700	jbo	mi'o troci
4432737	jbo	ko'a pu bajra
4432741	jbo	mi sisti
4432742	jbo	mi co'u seljibri
4432746	jbo	ko sanli
4432749	jbo	ko cikna
4432750	jbo	ko co'u sipna
4432759	jbo	mi pu to'e jinga
4432766	jbo	ko pamjai mi
4432782	jbo	ko co'a klama
4432795	jbo	mi pu farlu
4432807	jbo	ko kalri
4432832	jbo	ru'a na'ipei
4432863	jbo	ki'ai prane
4432881	jbo	do bajra
4432884	jbo	ko'a tolcliva
4432888	jbo	ko'a darca
4432908	jbo	ko cmibi'o le girzu pe mi'a
4432910	jbo	mi cilmo
4432950	jbo	ko cusku fi mi
4433615	jbo	la .tom. pu sisti lo nu ri klaku
4433617	jbo	la .tom. co'u klaku
4433623	jbo	la .tom. pu klama le zdane'i
4433624	jbo	la .tom. pu klama le nenri
4433635	jbo	la tom pu zerle'a lo jdini po mi
4433641	jbo	la .tom. ca'o xebni tu'a mi
4433644	jbo	la .tom. pu smaji sanli
4433650	jbo	la .tom. pu zerle'a lo mi kanjunla
4433651	jbo	la .tom. pu zerle'a lo kanjunla pe mi
4433653	jbo	la .tom. pu zgana sanli
4433662	jbo	la .tom. pu sanli je zgana
4433675	jbo	la .tom. sega'a pu sanli
4433680	jbo	la .tom. pu sisti lo nu ri citka
4433686	jbo	la .tom. pu co'u citka
4433687	jbo	la .tom. pu de'a citka
4433698	jbo	la .tom. pu za'ure'u sa'irbi'o
4433701	jbo	la .tom. pu co'u muvdu
4433703	jbo	la .tom. pu de'a pagmu'u
4433713	jbo	la .tom. pu co'u zdani basti
4434481	jbo	pu carvi
4434484	jbo	ko'a ba volve
4434488	jbo	mi pu pinxe lo blacykabri ladru
4434489	jbo	mi pu pinxe lo ladru be sela'u le ni blacykabri
4434493	jbo	le nu tankyva'u cu galfi le kamka'o
4434521	jbo	mu'i ma do spebi'o lo ninmu va'o le ka do zmanei lo'e nanmu
4434547	jbo	ko'a pu na'e ponse lo pinsi
4436837	jbo	lo'e traduki cu traide
4436842	jbo	gajanai la cevni na zasti gi sarcu fa lo nu finti ri
4437550	jbo	la .tam. cu xebni lo xebro
4437650	jbo	la tom pu imposta lo mikce
4437653	jbo	la tom pu jifkritrazu'e lo ka mikce
4437781	jbo	.e'u mi lanli facki fi lo se kakne be mi'o
4437794	jbo	ti pu se zvati lo nu la tom co'u jmive
4437803	jbo	xu da nabmi tcini do
4437822	jbo	la tom cu na'e se vudypai
4437826	jbo	xu lo nu do citka lo rismi cu roldei
4437856	jbo	xu do na'o citka lo rismi de'i roldei
4438097	jbo	gau la .meris. lo xrula cu fatri
4438119	jbo	la .meris. cu crida noltruti'u
4439857	jbo	la tom cu suksa co'a klaku
4439867	jbo	do lojycpa ma
4439871	jbo	mi pu na'aktigau le skami
4439876	jbo	ki'u ma do na ve ma'urcu'e
4439964	jbo	ki'u ma do lerci klama lo nunctu
4439989	jbo	mi pu no'e mutce cuxna
4442038	jbo	ju'a do na djica lo ka djuno
4442462	jbo	le sonci cu rorci da le ralju
4445147	jbo	di'u na cinri
4445150	jbo	a'ucu'i
4445171	jbo	go'i a'ucu'i
4445464	jbo	e'o ko ciska lo bazi se cusku be mi
4447689	jbo	lo'e nu da viska de cu nu da krici de
4449077	jbo	mi prami lo se prami ku
4453403	jbo	di'ai xabju xruti
4453428	jbo	ro te .arco cu te vecnu lo pikta
4453431	jbo	.oi doi nolraitru ko sisti lo nu do smugau mi lu'e lo do nanla .i mi jbeseltei lo nanca be li cire
4453466	jbo	lo'e nu viska cu nu krici
4453709	jbo	la .tom. cu nupre lo ka noroi za'ure'u lerci tsuku
4455183	jbo	la .tom. joi la .meris. cu kansi'u lo ka cliva
4455612	jbo	le cidro cu ratni li pa
4455613	jbo	lu doi tom mi xagji li'u co'e .i lu mi go'i li'u co'e
4456377	jbo	do xusra lo jitfa
4456847	jbo	kosmycau be lo kosmycau .i ro da kosmycau
4461746	jbo	jaginai ti nu traide gi ko se prali lo zmarai ra
4462421	jbo	no datpre cu djuno lo du'u makau lizdu'o mi
4462423	jbo	no datpre cu djuno lo dumdu'o be lo li'imdu be lo kamcedu be mi
4462425	jbo	no datpre cu djuno lo du'u makau li'i ce'u du mi
4462429	jbo	je'e ku taiku loi rusko
4463896	jbo	lo tarci cu te gusni ca lo cacra poi nu mi'o jmaji
4463897	jbo	ca midju lo nicte
4468001	jbo	mi nitcu lo nu do gasnu si'unai
4468917	jbo	la .tom. pu troci lo ka na cisma
4475138	jbo	le po'u ta sanga cu selzaumi'o loi nixli
4478792	jbo	mi na du lo do uanji
4478795	jbo	ti noi uanji cu mudri
4478803	jbo	ra dunda co'i fi lo panzi fe lo pa uanji
4487626	jbo	lo da'amei be lo bi plini be la .sol. cu claxu lo jmive
4488209	jbo	so'i verba cu krixa poi fanza
4488212	jbo	so'i verba cu krixa noi fanza
4488311	jbo	i do jbena ui dai i do jbena di'ai i do jbena doi la maris i do jbena ui sai
4488312	jbo	lo se renvi cu culno lo se spaji
4489987	jbo	ri'a ma do ca'o krixa
4513392	jbo	la tom pu cisma noi entuzi lo ka djica
4524508	jbo	do cusku du'e da
4525335	jbo	mi pu cpedu lo nu jmina lo silna lo mi ga'arpatlu
4551479	jbo	mi djuno fi za'u panono valsi
4551483	jbo	lo nu mi djuno fi xo kau valsi cu manci
4553527	jbo	lo glibau cu ricfu tu'a lo jai ci'e uenzi
4583351	jbo	lo traji be lo ka xamgu bei lo tadji be lo nu co'a kakne lo ka limna cu ka limna
4584971	jbo	do jai sarcu fai lo ka jarco lo se jetnu be lo du'u do ponse lo kibro mrilu judri
4587858	jbo	do djica se gi'u bilga vau lo ka cikna
4590332	jbo	ki'e i mi jimpe ca
4606971	jbo	e'u jmina me'o slaka bu e me'o denpa bu
4606972	jbo	ei jmina me'o slaka bu
4606980	jbo	mi co'i citka du'e da ca lo cabdei
4606981	jbo	mi pu citka du'e da co lo cabdei
4611490	jbo	ro djedi cu poi'i ke'a ro djedi poi lidne ke'a cu zmadu lo ka xamgu .i je lo cabdei cu zabna mupli lo ka go'i
4629327	jbo	mi djica lo ka cilre fi lo tokpona
4636282	jbo	le pa gerku ca sipna
4636284	jbo	le pa gerku ca ca'o sipna
4636288	jbo	le pa mlatu ca jersi le ricyratcu
4643561	jbo	e'e do ckeji lo ka paroi jai tcica mi i e'e mi ckeji lo ka za'uroi se tcica tu'a do
4645535	jbo	lo pa ninmu poi fe ke'a fa do pu tavla cu mensi mi
4652816	jbo	le fetsi ca cimlu lo ka badri
4656462	jbo	la maris pu dasni lo skapi
4673270	jbo	lo ka renvi na frili
4673553	jbo	su'o skepre cu krici lo du'u lo pa moi be lo nu ma'a penmi su'o nalterdi jmive ba fasnu ca lo bavla'i nanca be li ji'i pano
4673554	jbo	ma ca'o traji lo ka ricfu kei lo prenu pe lo munje
4673556	jbo	lo tcadu poi se xabju ra cu se xabju pa barda cecmu poi se bangu lo spano
4673557	jbo	ma krasi lo me ta sance
4673559	jbo	mi ba'o co'u pilno la .feisybuk.
4673560	jbo	mi nitcu tu'a su'o vlacku
4673561	jbo	lo sance pu jai rinka lo nu mi co'a cikna
4673562	jbo	lo loldi pu lenku
4673563	jbo	lo mi dakli cu mutce lo ka tilju
4673565	jbo	.ei do xenru
4673566	jbo	.e'a pei mi co'a kansa
4673567	jbo	mo'oi me ru
4673568	jbo	mi ba dasni lo drata taxfu .i .e'o ko ze'i catlu fa'a lo drata farna
4673569	jbo	ca lo cabna'a crisa mi pu ki'ogra zenba fi li re
4673570	jbo	mi na jimpe lo du'u ki'u ma kau la .paris. cu traji fi lo tcadu pe lo munje fe lo ka xo kau roi stuvi'e ce'u
4673573	jbo	ki'u ma do tai cinla
4673574	jbo	la .tom. ba na jinga
4673575	jbo	la .tom. ba'o fliba
4673576	jbo	la .tom. cu cizra
4673578	jbo	ko zenba lo ka xendo la .tom.
4673579	jbo	ko co'u darxi la .tom.
4673580	jbo	ko cusku zo coi la .tom.
4673581	jbo	la .tom. pu co'a fengu
4673582	jbo	la .tom. cu kakne lo ka cikre
4673583	jbo	ko fonta'a mi ca lo pavdei
4673584	jbo	ko na ciknygau la .tom.
4673585	jbo	mi pu fliba lo ka cikre
4673586	jbo	ju'o la .tom. cu fengu
4673587	jbo	mi pu viska tu'a do joi la .tom.
4673588	jbo	.ai mi troci lo ka cenba
4673589	jbo	xu la .tom. cu certu lo ka jukpa
4673590	jbo	ko co'u malxaksu lo jdini
4673591	jbo	la .tom. pu ganlygau pa kanla
4673592	jbo	mi pu tirna lo nu la .tom. cu sanga
4673594	jbo	la .tom. ta'e mutce lo ka pante
4673595	jbo	la .tom. na nitcu tu'a mi
4673596	jbo	la .tom. na nitcu tu'a mi'o
4673597	jbo	la .tom. ba'o co'a ricfu
4673598	jbo	la .tom. ca patfu
4673599	jbo	la .tom. na ba nitcu
4673600	jbo	xu do fengu la .tom.
4673601	jbo	.ei do sidju la .tom.
4673602	jbo	mu'i ma do ca'o denpa
4673603	jbo	lo speni be la .tom. cu zvati ma
4673604	jbo	ju'o la .tom. pu xagji
4673605	jbo	mi pu zi terve'u pa relxima
4673606	jbo	da'i na nabmi mi
4674861	jbo	la tom pu romoi lo ka tsuku
4675870	jbo	ti'e do ze'a pu bilma
4675903	jbo	mi pendo la .robertos.
4675905	jbo	ma plini gi'e traji lo ka zvajbi lo solri
4675909	jbo	si'au la .tom. na nanmu
4675917	jbo	la .tom. na'o no roi tavla la .meris.
4676024	jbo	bu'u ma ra ca'o limna
4676273	jbo	mi na'o surla ca lo zeldei
4676275	jbo	lo nu ra jdice ma kau pu spaji ro da
4676277	jbo	ra pu dasni pa melbi ke blabi pastu
4676281	jbo	ra pu zvaxru lo nenri
4676986	jbo	ra pu na jarco lo ka cinmo su'o da
4676989	jbo	ko pencu lo xadni be mi
4676991	jbo	lo virnu smacu pu jersi lo mlatu
4676994	jbo	do na bilga lo ka spuda lo preti
4676995	jbo	la .tom. cu cusku fau lo nu na pensi
4676998	jbo	mi no roi pu kanpe lo nu mi ba speni
4676999	jbo	do xabju mo'oi plini
4677000	jbo	.au pei kelci su'o da
4677001	jbo	.au mi citka su'o da
4677002	jbo	ra no roi pu kanpe lo nu ru ba fasnu
4677003	jbo	ra pu xusra lo du'u ra prami la cevni
4685325	jbo	pa bangu no roi banzu i ri du VBA
4702942	jbo	la .tom. cu xabju ze'o lo rirxe
4702953	jbo	xu lo ka se cmene zo .meris. cu zilfadni lo xabju be lo gugde pe do
4702955	jbo	xo prenu
4702956	jbo	ko xruse'a lo do keldai lo tanxe
4702964	jbo	ca lo prulamdei mi pa re'u kelci la .tenis.
4702965	jbo	ki'u ma mi'o ca'o cmila
4702966	jbo	.e'a la .tom. cu zukte ro se .aidji be ri
4702967	jbo	la .tom. pu simlu lo ka fengu
4702970	jbo	la .tom. jo'u la .meris. pu kansi'u lo ka citka lo vacysai
4702971	jbo	la .tom. pu viska mi'a ca lo prulamdei
4702973	jbo	klama fa la .tom. .e nai la .meris.
4702975	jbo	la .tom. pu dunda so'o cukta mi
4702981	jbo	la .tom. pu cliva pu lo nu mi darca
4702984	jbo	la .tom. ta'e pante
4702986	jbo	la .tom. na'o stati tu'a lo zgike
4702989	jbo	la .tom. ca'o co'a jai fanza mi
4702996	jbo	la .tom. pu cikre lo mi santa xau mi
4703007	jbo	la .tom. pu snada .i ku'i la .meris. na go'i
4703008	jbo	la .tom. pu xusra lo du'u la .meris. cu nelci do
4703023	jbo	la .tom. na se jibri lo ka sazri lo sorpeka .i xu ja'a go'i
4703030	jbo	la .tom. cu kakne ge nai lo ka tcidu gi nai lo ka ciska
4703035	jbo	la .tom. ba xrupleji fi mi ca lo bavla'i jeftu
4703050	jbo	ta satci lo ka mi pu djica lo nu mi viska ce'u
4703054	jbo	xu do jinvi lo du'u nandu fa lo ka se bangu lo fasybau
4703057	jbo	la .tom. pu tikpa mi
4703058	jbo	mi pu minde la .tom. lo ka zvasta
4703060	jbo	la .tom. pu kavbu pa smacu
4703065	jbo	mi cpedu fi la .tom. fe lo ka zvasta
4703114	jbo	mi pu cortu lo tuple ba lo nu ze'u cadzu
4703117	jbo	mi ba zvasta lo zdani ca lo bavlamdei
4703120	jbo	la .tom. pu xendo ro lo pendo be la .meris.
4703168	jbo	.e'o ko curmi lo nu mi ciksi
4709163	jbo	no drata cu poi'i mi skudji ke'a
4709165	jbo	mi ro jai vajni ba'o cusku
4710644	jbo	mi djuno lo du'u do djica lo frica be la'e do'i
4753707	jbo	le nakni cu du lo prenu poi mi'a pu tavla zu'ai ke'a
4755300	jbo	lo nu gubni samtci cu pe'a matra lo pu'u zbaske xagyga'i
4755307	jbo	xu ba krici zo'ei la .tam.
4755312	jbo	mi nelci le ra selpre .i ku'i mi ra na se cinmle
4755315	jbo	la .tam. po'o djuno lo la .meris. fonjudri
4755321	jbo	xu la .tam. pu su'o roi risna se nabmi
4755479	jbo	mi'a pu na gaurdju le nu tu cfari
4755483	jbo	.e'o ko na fanva dei
4755493	jbo	ra pu nitcu lo ka jdini seldju
4755496	jbo	.au nai mi spuda le ra xatra
4755501	jbo	pu na sarcu
4755503	jbo	lo xagji cityge'u ca ca'o gercmo vi lo klaji
4755505	jbo	la .tam. pu ba'orzu'e le ri xejykre te zu'e lo nu ra simlu lo ka na'azma
4755506	jbo	la .tam. pu ba'orzu'e le ri firkre te zu'e lo nu ra simlu lo ka na'azma
4755507	jbo	le'o ko mi terpa .i jo do darsi
4755512	jbo	le ni la .smit. sutra lo nu cusku pu rinka lo nu mi na ka'e jimpe lo'i ra selsku
4755519	jbo	ma'a ja'a to'ai simlu lo'e prenu lo te dubji'i be ra ku .e nai lo du be ra
4755527	jbo	ra pu cintypu'i lo cintyxra loi grasu
4755533	jbo	fi'o gunma loi se zerbe'e ra klama ne'a la .dan.
4755536	jbo	la .tam. ricfu nanmu
4755537	jbo	la .tam. rifnau
4755539	jbo	mi pu co'a cilre fi la .esperanton.
4755541	jbo	na ru'e mrodunja ne'i lei snime
4755547	jbo	.e'u sai do bevri lo santa ki'u tu'a loi ju'o ru'e carvi
4755548	jbo	la .tam. ca djica lo ka stali
4755553	jbo	mi ca za'o troci lo ka zgipli lo jgita tai la .erek.klaptyn.
4755558	jbo	ra pu ctuca ra fo lo'i ticyselzu'e co gundi
4755560	jbo	bi'u da ba ka'e nu danfu fliba
4755561	jbo	.ui cai la .kimis. cisma
4755563	jbo	la .kimis. cisma .ui cai
4755565	jbo	le kamni cu dau mei
4755566	jbo	le kamni cu pa no mei
4755569	jbo	coi terdi
4755570	jbo	coi se terdi
4755571	jbo	co'o nai
4755580	jbo	mi'a pu ze'i gunli'a ca lo jaurbeima'i
4755581	jbo	mi'a pu ze'i gunli'a ca lo relma'i
4755589	jbo	ma xamgu gau lau'u
4755591	jbo	ma xamgu gau la'e di'u
4755594	jbo	.ai mi pa moi fonjo'e
4755597	jbo	xu lo nu ba'orgau lo'i remselju'o ta'i loi nunkesfakli'u cu sarcu
4755600	jbo	le bloti pu zonkai le blobeitsina
4755602	jbo	la .tam. ca na se cnitcini lo ka se xajmi
4755604	jbo	mi lo so'i mei ra dejni
4755606	jbo	do na ka'e .erve ta
4755607	jbo	ko'a masno lo'e nu jdice .i ku'i ko'a sutra lo'e nu zukte
4755608	jbo	mi'a pu caidji lo nu panpi
4755610	jbo	tu'a na'e zo'e ca nabmi
4755613	jbo	.e'a pei ro'i mi reisku lo prera'a do
4755623	jbo	.e'o ru'e tu'a mi mintu
4755624	jbo	.au pei nai do ra vitke
4755625	jbo	xu nai do djica lo nu do ra vitke
4755631	jbo	do'e lo'e paprylolnoi lo cukta cmene .e lo karni cmene cu sa'orvlapoi
4755633	jbo	.e'e nai mi cfifa'i do lau'u
4755634	jbo	.e'e nai mi cfifi'a do la'e di'u
4755636	jbo	le mi bruna pu mrobi'o lo nunkarcyjanli
4755638	jbo	.u'u mi na samymri do pu le cabna
4755640	jbo	mi ro roi pamkansa lo na'azma ninmu
4755641	jbo	ko lebna ca'o lo nu klama
4755644	jbo	bi'u loi verba se senpi cu so'i mei
4755648	jbo	va'o ti poi nabmi na ka'e rivbi fa do le do se fuzme
4755652	jbo	xu ja'ai do na nu'ogle
4755658	jbo	le do se pesti'i cu jetnu
4755662	jbo	le cizra nanmu pu cadzu le dagysfe ru'u ri
4755667	jbo	.e'i cai mi do stigau
4755669	jbo	le gusni ca crino
4755670	jbo	crino gusni
4755675	jbo	pu mrobi'o lo velxai
4755676	jbo	pu mrobi'o tu'a lo cagna
4755683	jbo	le tumtru cu zanynu'e lo lamji selgau
4755687	jbo	la .tam. pu radycru lo si'o klama la .bastyn.
4755688	jbo	sa'u ko troci
4755689	jbo	ti pikta fi lo nu lo re prenu cu nerkla
4755691	jbo	ti pikta lo re prenu lo nu nerkla
4755692	jbo	la .tam. na djuno lo so'i mei la .meris. ca le purci
4755695	jbo	.e'o ko cpedu fi la .tam. fe lo nu jalge fonjo'e mi
4755696	jbo	ba jalge
4755698	jbo	da'i mu'i ma su'o da prezerle'a ra
4755699	jbo	ca jalge
4763151	jbo	au za'u prenu cu dunli mi lo ni certu tu'a le bangu i je je'a nandu fa lo ka jimpe fi do
4767634	jbo	zabna djepau di'ai
4767635	jbo	zabna pagbu lo djedi di'ai
4775261	jbo	doi le mikce ko mikce ko
4777497	jbo	i mu valsi dei pagbu
4812333	jbo	le xirma poi bajra fe'e ba'o le cange dinju co'i farlu
4812334	jbo	ma nelci la tonis
4812335	jbo	ma nelci lo insekto
4812336	jbo	ma nelci lo nu jamna
4812337	jbo	ma nelci le za'u mei
4812338	jbo	do nelci ma
4812339	jbo	ko na skicu fi mi fe lo nu mi simsa ma kau
4816884	jbo	.i jitfa
4816887	jbo	.i do ba zi sisti lo ka pensi tu'a ko'a
4817488	jbo	da mo jo nabmi
4820333	jbo	so'u bangu cu ckaji lo ka lo javni be lo nu lo se bacru cu mapti lo lerfu bei ce'u cu jai frili
4821800	jbo	fau'u
4821816	jbo	fi'i
4821818	jbo	.i xu morsi
4821824	jbo	doi mabla
4821826	jbo	.o'o cu'i
4821829	jbo	xagji xu
4821834	jbo	.o'u da'oi ko
4821835	jbo	.i ko na jundi la .tom.
4821836	jbo	lo mudri cu fulta
4835368	jbo	cinmo lo ka pu'o bai co'a pagbu pa drata munje
4846877	jbo	i lo ICANN cmene cu sinxa lo IP cmene lo DNS selfu
4925427	jbo	mi pu na'o capli'u tai do .i ba la'e di'u mi se darxi fi pa celga'a fo lo tupcidni
4925879	jbo	le fetsi cu se mensi re da
4926047	jbo	mi ne tai do pu na'o ckape litru i ba bo lo tuple cidni be mi cu se xrani pa cecla grana
5024433	jbo	farvi zenba
5024492	jbo	lo ka savru cu farvi se jdika
5024513	jbo	lo solgu'i cu farvi jdika
5032951	jbo	la .tam. te dabytadji
5033157	jbo	xu do renro lo sutra bolci
5033175	jbo	ma esporte poi do nelci
5033274	jbo	ro da tavla fi ko'a
5033339	jbo	ko'a puba'o djica lo nu ba binxo lo ctuca
5034438	jbo	xu mi kakne lo nu cpacu lo fukapi be ta
5034466	jbo	i'e
5034519	jbo	ko'a ralte lo so'i jdini se mau mi
5034591	jbo	le jefyfa'o pu mo
5034617	jbo	mi terpa tu'a lo gerku
5034656	jbo	pu cirko le junla
